FoodID,FoodDescription,FoodDescriptionF,ConversionFactorValue
2268,"Turnip greens and turnips, frozen, unprepared","Navet, feuilles et racines, congelées, non préparées",0.86644
2269,"Turnip greens and turnips, frozen, boiled, drained","Navet, feuilles et racines, congelées, bouillies, égouttées",0.85
2270,"Vegetables, mixed, canned, solids and liquid","Légumes, macédoine, conserve, solides et liquide",2.58876
2271,"Vegetables, mixed, frozen, unprepared","Légumes, macédoine, congelée, non préparée",0.9615
2272,"Vegetables, mixed, frozen, boiled, drained","Légumes, macédoine, congelée, bouillie, égouttée",0.85
2273,"Vine spinach, raw","Baselle, crue",0.65
2274,"Waterchestnuts, Chinese, raw","Châtaignes d'eau, chinoises, crues",0.85
2275,"Waterchestnuts, Chinese, canned, solids and liquid","Châtaignes d'eau, chinoises, conserve, solides et liquide",1.4793
2276,"Watercress, raw","Cresson de fontaine, cru",0.85
2277,"Waxgourd (Chinese preserving melon), raw","Waxgourd (melon d'eau chinois), cru",57.0
2278,"Waxgourd (Chinese perserving melon), boiled, drained","Waxgourd (melon d'eau chinois), bouilli, égoutté",0.85
2279,"Winged beans (goa bean), green, raw","Pois carrés, verts, crus",0.85
2280,"Winged beans (goa bean), green, boiled, drained","Pois carrés, verts, bouillis, égouttés",0.85
2281,"Winged beans (goa bean) leaves, raw","Pois carrés, feuilles, crues",0.31699
2282,"Winged beans (goa bean) tuber, raw","Pois carrés, tubercule, cru",0.85
2283,"Yam, raw","Igname, crue",0.85
2284,"Yam, boiled, drained or baked","Igname, bouillie, égouttée ou au four",0.85
2285,"Yambean (jimaca), tuber, raw","Doliques bulbeux, crus",0.85
2286,"Yambean (jimaca), tuber, boiled, drained","Doliques bulbeux, bouillis, égouttés",0.5495
2287,"Borage, raw","Bourrache, crue",0.65
2288,"Borage, boiled, drained","Bourrache, bouillie, égouttée",0.85
2289,"Chives, freeze-dried","Ciboulette, lyophilisée",0.04
2290,"Dock (sorrel), raw","Oseille, cru",0.65
2291,"Dock (sorrel), boiled, drained","Oseille, bouilli, égoutté",1.9026
2292,"Eppaw, raw","Eppaw de l'Oregon, cru",0.04
2293,"Drumstick (horseradish-tree), pods, raw","Cassier (ben oléifère), gousses, crues",0.85
2294,"Drumstick (horseradish-tree), pods, boiled, drained","Cassier (ben oléifère), gousses, bouillies, égouttées",1.24689
2295,"Kale, scotch, raw","Chou à feuilles, non pommé, cru",0.85
2296,"Kale, scotch, boiled, drained","Chou à feuilles, non pommé, bouilli, égoutté",0.85
2297,"Leeks (bulb and lower-leaf portion), freeze-dried","Poireaux (bulbe et portion inférieure), lyophilisés",0.08112
2298,"Parsley, freeze-dried","Persil, lyophilisé",0.0593
2299,"Beans, mung, mature seeds, sprouted, bean sprouts, canned, drained","Haricots, mungo, secs, germés, germes de haricot, conserve, solides égouttés",1.32079
2300,"Pepper, sweet, green, freeze-dried","Poivron vert, lyophilisé",0.01623
2301,"Radish, white icicle, raw","Radis, ""white icicle"", cru",0.51
2302,"Shallot, freeze-dried","Échalote, lyophilisée",0.03652
2303,"Squash, summer, all varieties, raw","Courge d'été, toutes variétés, crues",0.85
2304,"Squash, summer, all varieties, boiled, drained","Courge d'été, toutes variétés, bouillies, égouttées",2.53593
2305,"Squash, winter, all varieties, raw","Courge d'hiver, toutes variétés, crues",0.85
2306,"Squash, winter, all varieties, baked","Courge d'hiver, toutes variétés, cuites au four",0.85
2307,"Sweet potato, canned, syrup pack, solids and liquid","Patate douce, conserve, dans du sirop, solides et liquide",1.6
2308,"Sweet potato, canned, syrup pack, drained solids","Patate douce, conserve, dans du sirop, solides égouttés",1.6
2309,"Tomato products, canned, sauce, spanish style","Produits à base de tomates, conserve, sauce, style espagnol",0.61877
2310,"Beans, pinto, mature seeds, sprouted, raw","Haricots, pinto, secs, germés, crus",2.0394
2311,"Beans, pinto, mature seeds, sprouted, boiled, drained","Haricots, pinto, secs, germés, bouillis, égouttés",1.80693
2312,"Carrot juice, canned","Carotte, jus, conserve",2.49366
2313,"Corn pudding , homemade","Maïs, pouding, fait maison",2.64159
2314,"Potato, mashed, homemade, prepared with whole milk","Pomme de terre, purée, faite maison, préparée avec lait entier",1.4
2315,"Spinach souffle, homemade","Épinard, soufflé, fait maison",1.43702
2316,"Sweet potato, cooked, candied, homemade","Patate douce, cuite, confite, faite maison",1.25
2317,"Tomato, red, ripe, stewed (scalloped with breadcrumbs)","Tomate, rouge, mûre, étuvée (escalopes avec chapelure)",1.0672
2318,"Seaweed, agar, dried","Algue, agar, séché",0.03804
2319,"Seaweed, spirulina, raw","Algue, spiruline, crue",0.84531
2320,"Seaweed, spirulina, dried","Algue, spiruline, séchée",0.03804
2321,"Seaweed, wakame, raw","Algue, wakame, cru",0.15
2322,"Pepper, hot chili, red or green, raw","Piment, fort du Chili, rouge ou verts, cru",0.3
2323,"Potato, O'brien, homemade","Pomme de terre, O'brien, faite maison",1.1
2324,"Potato pancake, homemade","Pommes de terre, crêpe, faite maison",0.75
2325,"Radish seeds, sprouted, with seed, raw","Radis, graines, germées, avec graines, crues",0.65
2326,"Shallot, raw","Échalote, crue",0.3
2327,"Artichoke (Globe, French), boiled, drained, with salt","Artichaut, bouilli, égoutté, sel ajouté",0.85
2328,"Beans, snap (Italian, green or yellow), frozen, boiled, with salt","Haricots italiens, jaunes ou verts, congelés, bouillis, sel ajouté",0.85
2330,"Beans, snap, yellow, frozen, boiled, with salt","Haricots jaunes, congelés, bouillis, sel ajouté",0.85
2331,"Broccoli, frozen, spears, boiled, drained, with salt","Brocoli, congelé, tiges et têtes, bouillies, égouttées, sel ajouté",0.37
2332,"Collards, boiled, drained, with salt","Chou cavalier (collards), bouilli, égoutté, sel ajouté",0.85
2333,"Cowpeas, boiled, drained, with salt","Doliques à oeil noir, bouillis, égouttés, sel ajouté",0.85
2335,"Potato, mashed, dehydrated, granules without milk, prepared with whole milk and margarine","Pomme de terre, purée, déshydratée, granules sans lait, préparée avec lait entier et margarine",1.4
2336,"Potato, mashed, homemade, prepared with whole milk and butter","Pomme de terre, purée, faite maison, préparée avec lait entier et beurre",1.4
2337,"Pickles, cucumber, sweet","Marinades, cornichons sucrés",1.61673
2338,"Pickles, cucumber, sour","Marinades, cornichons sûrs",0.3
2339,"Pickle relish, hot dog","Marinades, relish, chien chaud (hot-dog)",0.15
2340,"Pickle relish, sweet","Marinades, relish, sucrée",0.1
2341,"Pickles, cucumber, sour, low sodium","Marinades, cornichons sûrs, faible en sodium",0.3
2342,"Pickles, cucumber, sweet, low sodium","Marinades, cornichons sucrés, faible en sodium",0.25
2343,"Mushroom, enoki, raw","Champignon, enoki, cru",0.3
2344,"Pepper, sweet, yellow, raw","Poivron jaune, cru",0.93
2345,"Radicchio, raw","Radicchio, cru",0.65
2346,"Squash, summer, zucchini, baby, raw","Courges d'été, courgettes (zucchini), naines, crues",0.85
2347,"Tomatillo, raw","Tomatille, crue",0.85
2348,"Tomato, sun-dried","Tomate, séchée au soleil",0.13697
2349,"Tomato, sun-dried, packed in oil, drained","Tomate, séchée au soleil, empaquetée dans l'huile, égouttée",0.27895
2350,"Fennel, bulb, raw","Fenouil, bulbe, cru",0.85
2351,"Pickle relish, hamburger","Marinades, relish, hambourgeois",0.15
2352,"Arugula, raw","Roquette (arugula), crue",0.65
2353,"Carrot, baby, raw","Carotte, petite, crue",0.8
2354,"Hearts of palm, canned","Palmiers, coeurs, conserve",0.66
2355,"Pepper, hot chili, red, sun-dried","Piment, fort du Chili, rouge, séché au soleil",0.04
2356,"Nopales (prickly pear), raw","Nopales (figue de Barbarie), crus",0.85
2357,"Nopales (prickly pear), cooked","Nopales (figue de Barbarie), cuits",0.85
2358,"Cauliflower, green, raw","Chou-fleur, vert, cru",0.85
2359,"Cauliflower, green, boiled","Chou-fleur, vert, bouilli",0.85
2360,"Cauliflower, green, boiled, with salt","Chou-fleur, vert, bouilli, sel ajouté",0.85
2361,"Cabbage, raw","Chou, cru",7.14
2362,"Cabbage, boiled, drained","Chou, bouilli, égoutté",0.85
2363,"Cucumber, raw","Concombre, cru",0.85
2364,"Artichoke (Globe, French), raw","Artichaut, cru",0.85
2365,"Artichoke (Globe, French), boiled, drained","Artichaut, bouilli, égoutté",0.85
2366,"Asparagus, canned, drained solids","Asperge, conserve, égouttée",1.08
2367,"Bamboo shoots, canned, drained solids","Bambou, pousses, conserve, égouttées",1.38419
2368,"Beans, lima, baby, frozen, unprepared","Haricots, lima, petits, congelés, non préparés",0.85
2369,"Beans, lima, baby, frozen, boiled, drained","Haricots, lima, petits, congelés, bouillis, égouttés",0.85
2370,"Beans, snap (Italian, green or yellow), raw","Haricots italiens, jaunes ou verts, crus",0.85
2371,"Beans, snap (Italian, green or yellow), boiled, drained","Haricots italiens, jaunes ou verts, bouillis, égouttés",0.85
2372,"Beans, snap (Italian, green or yellow), canned, drained solids","Haricots italiens, jaunes ou verts, conserve, solides égouttés",1.6484
2373,"Beets, canned, drained solids","Betteraves, conserve, solides égouttés",0.24
2374,"Broccoli, raw","Brocoli, cru",0.85
2375,"Broccoli, boiled, drained","Brocoli, bouilli, égoutté",0.85
2376,"Broccoli, frozen, chopped, unprepared","Brocoli, congelé, haché, non préparé",0.85
2377,"Broccoli, frozen, chopped, boiled, drained","Brocoli, congelé, haché, bouilli, égoutté",0.85
2378,"Brussels sprouts, raw","Choux de Bruxelles, crus",0.76
2379,"Brussels sprouts, boiled, drained","Choux de Bruxelles, bouillis, égouttés",0.84
2380,"Carrot, raw","Carotte, crue",0.85
2381,"Carrot, boiled, drained","Carotte, bouillie, égouttée",2.40913
2382,"Carrot, canned, drained solids","Carotte, conserve, solides égouttés",2.40913
2383,"Carrot, frozen, unprepared","Carotte, congelée, non préparée",0.85
2384,"Carrot, frozen, boiled, drained","Carotte, congelée, bouillie, égouttée",0.85
2385,"Cauliflower, raw","Chou-fleur, cru",1.13066
2386,"Celery, raw","Céleri, cru",0.85
2387,"Celery, boiled, drained","Céleri, bouilli, égoutté",0.85
2388,"Corn, sweet, yellow, raw","Maïs sucré, jaune, cru",0.85
2389,"Corn, sweet, canned, cream style","Maïs sucré, conserve, en crème",2.70499
2390,"Corn, sweet, canned, vacuum pack, niblets","Maïs sucré, conserve, emballage sous vide, grains entiers",2.21894
2391,"Corn, sweet, yellow, frozen, kernels cut off the cob, unprepared","Maïs sucré, jaune, congelé, en grains, non préparé",0.85
2392,"Corn, sweet, yellow, frozen, kernels cut off the cob, boiled, drained","Maïs sucré, jaune, congelé, en grains, bouilli, égoutté",1.74354
2393,"Corn, sweet, frozen, kernels on the cob, unprepared","Maïs sucré, congelé, en épi, non préparé",1.74354
2394,"Garlic, raw","Ail, cru",0.04
2395,"Kale, raw","Chou vert frisé, cru",0.85
2396,"Leeks (bulb and lower-leaf portion), raw","Poireaux (bulbe et portion inférieure), crus",0.85
2397,"Leeks (bulb and lower-leaf portion), boiled, drained","Poireaux (bulbe et portion inférieure), bouillis, égouttés",0.85
2398,"Lettuce, iceberg",Laitue iceberg (pommée),0.23247
2399,"Mushroom, white, raw","Champignon, blanc, cru",0.54
2400,"Mushroom, canned, drained solids","Champignon, conserve, solides égouttés",1.64835
2401,"Onion, raw","Oignon, cru",0.40575
2402,"Onion, boiled, drained","Oignon, bouilli, égoutté",0.85
2403,"Onion rings, breaded, par-fried, frozen, unprepared","Oignons en rondelles, panés, pré-frits, congelés, non préparés",0.7
2404,"Onion rings, breaded, par fried, frozen, heated in oven","Oignons en rondelles, panés, pré-frits, congelés, chauffés au four",0.7
2405,"Parsley, fresh","Persil, frais",0.04
2406,"Parsnip, raw","Panais, cru",0.85
2407,"Parsnip, boiled, drained","Panais, bouilli, égoutté",0.85
2408,"Peas, edible-podded (snow peas), raw","Pois mange-tout, crus",0.34
2409,"Peas, green, raw","Pois, petits (verts), crus",0.85
2410,"Peas, green, boiled, drained","Pois, petits (verts), bouillis, égouttés",0.85
2411,"Peas, green, canned, drained solids","Pois, petits (verts), conserve, solides égouttés",1.79628
2412,"Peas, green, frozen, boiled, drained","Pois, petits (verts), congelés, bouillis, égouttés",0.85
2413,"Pepper, sweet, green, raw","Poivron vert, cru",0.27
2414,"Pepper, sweet, green, boiled, drained","Poivron vert, bouilli, égoutté",0.85
2415,"Pepper, sweet, green, frozen, chopped, unprepared","Poivron vert, congelé, haché, non préparé",0.5288
2416,"Pepper, sweet, green, frozen, chopped, boiled, drained","Poivron vert, congelé, haché, bouilli, égoutté",0.7188
2417,"Potato, flesh, raw","Pomme de terre, chair, crue",1.1
2418,"Potato, skin, raw","Pomme de terre, pelure, crue",0.85
2419,"Potato, flesh, baked","Pomme de terre, chair, cuite au four",0.78
2420,"Potato, skin, baked","Pomme de terre, pelure, cuite au four",1.16
2421,"Potato, boiled with skin, flesh","Pomme de terre, bouillie avec la pelure, chair",0.68
2422,"Potato, boiled without skin, flesh","Pomme de terre, bouillie sans pelure, chair",0.835
2423,"Potato, flesh, cooked in skin, microwaved","Pomme de terre, chair, cuite au four à micro-ondes avec la pelure",1.1
2424,"Potato, skin, cooked in skin, microwaved","Pomme de terre, pelure, cuite au four à micro-ondes avec la pelure",1.16
2425,"Potato, canned, drained solids","Pomme de terre, conserve, solides égouttés",1.4
2426,"Potato, mashed, flakes without milk, dry","Pomme de terre, purée, flocons sans lait, sec",0.634
2427,"Potato, mashed, prepared from flakes without milk, whole milk and butter added","Pomme de terre, purée, préparée à partir de flocons sans lait, lait entier et beurre ajoutés",1.4
2428,"Potato, scalloped, dry mix, unprepared","Pomme de terre, en escalopes, mélange sec, non préparé",
2429,"Potato, scalloped, dry mix, prepared with water, whole milk and butter","Pomme de terre, en escalopes, mélange sec, préparé avec eau, lait entier et beurre",2.5888
2430,"Potato, hashed brown, frozen, plain, unprepared","Pomme de terre, rissolée, congelée, non préparée",0.85
2431,"Potato, hashed brown, frozen, plain, prepared","Pomme de terre, rissolée, congelée, nature, préparée",1.58503
2432,"Potato puff, frozen, unprepared","Pomme de terre, soufflée, congelée, non préparée",0.85
2433,"Potato puff, frozen, prepared","Pomme de terre, soufflée, congelée, préparée",0.79
2434,"Potato, french-fried, frozen, unprepared","Pomme de terre, frite, congelée, non préparée",0.85
2435,"Potato, french-fried, frozen, all types, salt added in processing, home-prepared, heated in oven","Pomme de terre, frite, congelée, tous les types, sel ajouté lors de la transformation, réchauffée au four",1.0
2436,"Potato, french-fried, frozen, restaurant prepared, fried in vegetable oil","Pomme de terre, frite, congelée, préparée au restaurant avec de l'huile végétale",0.85
2437,"Potato, french-fried, frozen, cottage cut, salt not added in processing, unprepared","Pomme de terre, frite, congelée, coupe cottage, sans sel ajouté lors de la transformation, non préparée",1.3
2438,"Potato, french-fried, frozen, cottage cut, salt not added in processing, heated in oven","Pomme de terre, frite, congelée, coupe cottage, sel non ajouté lors de la transformation, réchauffée au four",0.85
2439,"Potato, french-fried, frozen, extruded, heated in oven","Pomme de terre, frite, congelée, extrudée, réchauffée au four",0.85
2440,Potato flour,"Pomme de terre, farine",0.2
2441,"Pumpkin, raw","Citrouille, crue",0.85
2442,"Pumpkin, boiled, drained","Citrouille, bouillie, égouttée",0.85
2443,"Radish, raw","Radis, cru",0.135
2444,"Rutabaga (swede), raw","Rutabaga (chou-navet),  cru",0.85
2445,"Rutabaga (swede), boiled, drained","Rutabaga (chou-navet), bouilli, égoutté",0.85
2447,"Spinach, canned, drained solids","Épinard, conserve, égoutté",2.2612
2448,"Squash, winter, acorn, raw","Courge d'hiver, courge poivrée (courgeon), crue",0.85
2449,"Squash, winter, acorn, baked","Courge d'hiver, courge poivrée (courgeon), cuite au four",0.85
2450,"Squash, winter, acorn, boiled, mashed","Courge d'hiver, courge poivrée (courgeon), bouillie, en purée",0.85
2451,"Squash, winter, butternut, raw","Courge d'hiver, courge musquée, crue",1.52797
2452,"Squash, winter, butternut, baked","Courge d'hiver, courge musquée, cuite au four",0.85
2453,"Squash, winter, butternut, frozen, unprepared","Courge d'hiver, courge musquée, congelée, non préparée",1.29438
2454,"Squash, winter, butternut, frozen, boiled","Courge d'hiver, courge musquée, congelée, bouillie",0.85
2455,"Squash, winter, hubbard, raw","Courge d'hiver, hubbard, crue",0.85
2456,"Squash, winter, hubbard, baked","Courge d'hiver, hubbard, cuite au four",0.85
2457,"Squash, winter, hubbard, boiled, mashed","Courge d'hiver, hubbard, bouillie, en purée",0.85
2458,"Squash, winter, spaghetti, raw","Courge d'hiver, spaghetti, crue",0.85
2459,"Squash, winter, spaghetti, baked or boiled, drained","Courge d'hiver, spaghetti, au four ou bouillie, égouttée",0.85
2460,"Tomato, red, ripe, raw, year round average","Tomate, rouge, mûre, crue, moyenne durant toute l'année",0.85
2461,"Tomato, red, ripe, boiled","Tomate, rouge, mûre, bouillie",0.85
2462,"Tomato, red, ripe, canned, whole","Tomate, rouge, mûre, conserve, entière",0.82
2463,"Tomato, red, ripe, canned, stewed","Tomate, rouge, mûre, conserve, étuvée",2.69442
2464,"Juice, tomato, canned","Jus, tomates, conserve",2.56762
2465,"Tomato products, canned, sauce","Produits à base de tomates, conserve, sauce",0.6213
2466,"Tomato products, canned, sauce with mushrooms","Produits à base de tomates, conserve, sauce avec champignons",0.6213
2467,"Tomato products, canned, sauce with herbs and cheese","Produits à base de tomates, conserve, sauce avec fines herbes et fromage",0.6213
2468,"Tomato products, canned, sauce with onions, green peppers and celery","Produits à base de tomates, conserve,  sauce avec oignons, poivrons verts et céleri",0.63398
2469,"Tomato products, canned, sauce with tomato tidbits","Produits à base de tomates, conserve, sauce avec morceaux de tomates",0.61877
2470,"Turnip, raw","Navet, cru",0.85
2471,"Turnip, frozen, unprepared","Navet, congelé, non préparé",0.86644
2472,"Turnip, frozen, boiled, drained","Navet, congelé, bouilli, égoutté",0.85
2473,"Vegetable juice cocktail, canned","Légumes, jus, cocktail, conserve",2.6734
2474,"Vegetables, mixed, canned, drained solids","Légumes, macédoine, conserve, solides égouttés",1.72232
2475,"Beets, harvard, canned, solids and liquid","Betteraves harvard, conserve, solides et liquide",2.59932
2476,"Beets, pickled, canned, solids and liquid","Betteraves marinées, conserve, solides et liquide",0.06
2477,"Pepper, jalapeno, canned, solids and liquid","Piment jalapeno, conserve, solides et liquide",0.3
2478,"Potato, flesh and skin, baked","Pomme de terre, chair et pelure, cuite au four",0.865
2479,"Potato, flesh and skin, cooked in skin, microwaved","Pomme de terre, chair et pelure, cuite au four à micro-ondes avec la pelure",0.85059
2480,"Broccoli, boiled, drained, with salt","Brocoli, bouilli, égoutté, sel ajouté",0.85
2481,"Celery, boiled, drained, with salt","Céleri, bouilli, égoutté, sel ajouté",0.85
2482,"Corn, sweet, yellow, frozen, kernels cut off the cob, boiled, drained, with salt","Maïs sucré, jaune, congelé, en grains, bouilli, égoutté, sel ajouté",1.74354
2483,"Onion, boiled, drained, with salt","Oignon, bouilli, égoutté, sel ajouté",0.85
2484,"Pepper, sweet, red, raw","Poivron rouge, cru",0.595
2485,"Pepper, sweet, green, boiled, drained, with salt","Poivron vert, bouilli, égoutté, sel ajouté",0.85
2486,"Pepper, sweet, red, boiled, drained","Poivron rouge, bouilli, égoutté",0.85
2487,"Pepper, sweet, red, boiled, drained, with salt","Poivron rouge, bouilli, égoutté, sel ajouté",0.85
2490,"Tomato, red, ripe, boiled, with salt","Tomate, rouge, mûre, bouillie, sel ajouté",1.11
2491,"Corn, sweet, white, frozen, kernels off cob, unprepared","Maïs sucré, blanc, congelé, grains, non préparé",1.74354
2492,"Corn, sweet, white, frozen, kernels off cob, boiled, drained","Maïs sucré, blanc, congelé, grains, bouilli, égoutté",0.85
2493,"Corn, sweet, white, frozen, kernels off cob, boiled, drained, with salt","Maïs sucré, blanc, congelé, grains, bouilli, égoutté, sel ajouté",1.74354
2494,Tomato ketchup (catsup),"Tomates, ketchup (catsup)",0.09
2495,"Pickles, cucumber, dill (includes Kosher and Polish)","Marinades, cornichons à l'aneth (inclus Cacher et Polonais)",0.3
2496,"Pimento, canned","Piments de la Jamaïque, conserve",2.02874
2497,"Pickles, cucumber, dill, low sodium","Marinades, cornichons à l'aneth, faible en sodium",0.3
2498,"Tomato ketchup (catsup), low sodium","Tomates, ketchup (catsup), faible en sodium",0.09
2499,"Seaweed, dulse (laver, nori), dried","Algue, dulse (rhodymemie palme, porphyre, nori), séchée",0.03804
2500,"Beets, raw","Betteraves, crues",0.85
2501,"Beets, boiled, drained","Betteraves, bouillies, égouttées",0.85
2502,"Fiddlehead greens (ferns), frozen, unprepared","Crosses de fougères (têtes de violon), congelées, non préparées",0.85
2505,"Potato, flesh and skin, raw","Pomme de terre, chair et pelure, crue",1.1
2506,"Potato, boiled, flesh and skin","Pomme de terre, bouille, chair et pelure",0.75
2507,"Seeds, breadfruit seeds, raw","Graines, fruits à pain, graines, crues",0.3
2508,"Seeds, breadfruit seeds, boiled","Graines, fruits à pain, graines, bouillies",0.3
2509,"Seeds, breadnuttree seeds, raw","Graines, noix-pain (brosimum dicastrum), graines, crues",0.3
2510,"Seeds, breadnuttree seeds, dried","Graines, noix-pain (brosimum alicastrum), graines, déshydratées",0.3
2511,"Seeds, chia seeds, dried","Graines de chia, déshydratées",0.43216
2512,"Seeds, cottonseed flour, partially defatted","Graines, farine de graines de coton, partiellement dégraissées",0.2
2513,"Seeds, cottonseed flour, low fat","Graines, farine de graines de coton, faible en gras",0.2
2514,"Seeds, cottonseed meal, partially defatted","Graines, semoule de graines de coton, partiellement dégraissées",0.3
2515,"Seeds, lotus seeds, dried","Graines, lotus, graines, déshydratées",0.3
2516,"Seeds, pumpkin and squash seed kernels, dried","Graines, citrouille et courge, graines, déshydratées",0.3
2517,"Seeds, pumpkin and squash seed kernels, roasted","Graines, citrouille et courge, graines, rôties",0.3
2518,"Seeds, safflower seed kernels, dried","Graines, carthame, graines, déshydratées",0.3
2519,"Seeds, safflower seed meal, partially defatted","Graines,  semoule de graines de carthame, partiellement dégraissée",0.2
2521,"Seeds, sesame seeds, whole, roasted and toasted","Graines, sésame, graines, entières, rôties et grillées",0.3
2522,"Seeds, sesame seed kernels, toasted, shelled","Graines, sésame, graines, grillées, décortiquées",0.3
2523,"Seeds, sesame flour, partially defatted","Graines, farine de sésame, partiellement dégraissées",0.2
2524,"Seeds, sesame flour, low fat","Graines, farine de sésame, faible en gras",0.2
2525,"Seeds, sesame meal, partially defatted","Graines, semoule de sésame, partiellement dégraissées",0.2
2526,"Seeds, sunflower seed kernels, dried","Graines, tournesol, graines, déshydratées",0.73968
2527,"Seeds, sunflower seed kernels, dry roasted","Graines, tournesol, graines, rôties à sec",0.67628
2528,"Seeds, sunflower seed kernels, toasted","Graines, tournesol, graines, grillées",0.3
2529,"Seeds, sunflower seed butter","Graines, beurre de tournesol",0.32432
2530,"Seeds, sunflower seed flour, partially defatted","Graines, tournesol, farine, partiellement dégraissée",0.2
2531,"Nuts, acorns, raw","Noix, balanes (glands), crues",0.3
2532,"Nuts, acorns, dried","Noix, balanes (glands), séchées",0.3
2533,"Nuts, acorn flour, full-fat","Noix, farine de balanes (glands), non dégraissée",0.2
2534,"Nuts, almonds, dried, unblanched, unroasted","Noix, amandes, séchées, non blanchies, non rôties",0.3
2535,"Nuts, almonds, dried, blanched, unroasted","Noix, amandes, séchées, blanchies, non rôties",0.3
2536,"Nuts, almonds, dry roasted, unblanched","Noix, amandes, rôties à sec, non blanchies",0.58326
2537,"Nuts, almonds, oil roasted, unblanched","Noix, amandes, rôties dans l'huile, non blanchies",0.3
2538,"Nuts, almonds, oil roasted, blanched","Noix, amandes, rôties dans l'huile, blanchies",0.3
2539,"Nuts, almonds, toasted, unblanched","Noix, amandes, grillées, non blanchies",0.3
2540,"Nuts, almond paste, sweetened","Noix, pâte d'amandes, sucrée",0.57566
2543,"Nuts, beechnuts, dried","Noix, faines, séchées",0.3
2544,"Nuts, brazilnuts, dried, unblanched","Noix, noix de Brésil, séchées, non blanchies",0.3
2545,"Nuts, butternuts (long walnuts), dried","Noix, noix longues (noix cendres), séchées",0.3
2546,"Nuts, cashew nuts, dry roasted","Noix, noix d'acajou (cajous, anacardes), rôties à sec",0.3
2547,"Nuts, cashew nuts, oil roasted","Noix, noix d'acajou (cajous, anacardes), rôties dans l'huile",0.3
2548,"Nuts, cashew butter, plain","Noix, beurre d'acajou (cajous, anacardes), nature",0.32432
2549,"Nuts, Chinese chestnuts, raw","Noix, châtaignes chinoises, crues",0.36
2550,"Nuts, Chinese chestnuts, dried","Noix, châtaignes chinoises, séchées",0.3
2551,"Nuts, Chinese chestnuts, boiled and steamed","Noix, châtaignes chinoises, bouillies et cuites à la vapeur",0.3
2552,"Nuts, Chinese chestnuts, roasted","Noix, châtaignes chinoises, rôties",0.3
2553,"Nuts, European chestnuts (sweet), raw, unpeeled","Noix, châtaignes d'Europe (marrons), crues, avec l'écorce",0.3
2554,"Nuts, European chestnuts (sweet), raw, peeled","Noix, châtaignes d'Europe (marrons), crues, décortiquées",0.3
2555,"Nuts, European chestnuts (sweet), dried, unpeeled","Noix, châtaignes d'Europe (marrons), séchées, avec l'écorce",0.36
