FoodID,FoodDescription,FoodDescriptionF,ConversionFactorValue
2,Cheese souffle,Soufflé au fromage,1.0038
4,"Chop suey, with meat, canned","Chop suey, avec viande, conserve",2.3246
5,"Chinese dish, chow mein, chicken","Mets chinois, chow mein, poulet",2.32472
6,Corn fritter,"Maïs, beignet",0.55
7,"Beef pot roast, with browned potatoes, peas and corn","Boeuf braisé, avec pomme de terre au four, pois et maïs",1.4
8,"Fried chicken, mashed potatoes and vegetables",Poulet frit avec pommes de terre en purée et légumes,1.4
9,"Meat loaf with tomato sauce, mashed potatoes and peas","Pain de viande avec sauce aux tomates, pommes de terre en purée et pois",1.95
10,Sliced turkey with mashed potatoes and peas,Dinde tranchée avec pommes de terre en purée et pois,1.4
13,"Vinegar, cider","Vinaigre, cidre",0.05068
14,"Vinegar, distilled (white)","Vinaigre, distillé (blanc)",0.05068
16,"Butter, whipped",Beurre fouetté,0.0319
17,"Butter oil, anhydrous","Huile de beurre, anhydre",0.86649
18,"Cheese, blue",Fromage bleu,0.3
19,"Cheese, brick",Fromage brick,0.3
20,"Cheese, brie",Fromage brie,2.53605
21,"Cheese, camembert",Fromage camembert,0.3
22,"Cheese, caraway",Fromage carvi,0.3
23,"Cheese, cheshire",Fromage cheshire,0.3
24,"Cheese, colby",Fromage colby,0.3
25,"Cheese, cottage, creamed (4.5% M.F.)","Fromage cottage en crème (4,5% M.G.)",1.25
26,"Cheese, cottage, creamed with fruit",Fromage cottage en crème avec fruits,1.25
27,"Cheese, cottage, uncreamed, dry curd (0.4% M.F.)","Fromage cottage sec pressé (0,4% M.G.)",1.25
28,"Cheese, cream",Fromage à la crème,0.29392
29,"Cheese, edam",Fromage edam,0.3
30,"Cheese, fontina",Fromage fontina,0.5579
31,"Cheese, gjetost",Fromage gjetost,0.3
32,"Cheese, gruyere",Fromage gruyère,0.3
33,"Cheese, limburger",Fromage limburger (limbourg),0.3
34,"Cheese, monterey",Fromage monterey,0.3
35,"Cheese, mozzarella, (48% water, 25% M.F.)","Fromage mozzarella (48%d'humidité, 25% M.G.)",0.3
37,"Cheese, muenster",Fromage muenster,0.3
38,"Cheese, neufchatel",Fromage neufchatel,1.0144
39,"Cheese, parmesan, dry grated","Fromage parmesan, râpé",0.15
40,"Cheese, parmesan, hard","Fromage parmesan, pâte dure",0.4227
41,"Cheese, port-salut",Fromage port-salut,0.3
42,"Cheese, provolone",Fromage provolone,0.3
43,"Cheese, ricotta, with whole milk","Fromage ricotta, avec lait entier",2.62059
44,"Cheese, ricotta, with partly skimmed milk","Fromage ricotta, avec lait partiellement écrémé",1.0
45,"Cheese, romano",Fromage romano,0.0634
46,"Cheese, roquefort (blue)",Fromage roquefort (bleu),0.3
47,"Cheese, swiss (emmental)",Fromage suisse (emmental),0.3
48,"Cheese, tilsit, with whole milk","Fromage tilsit, avec lait entier",0.3
51,"Cheese, processed, cheddar, cold pack","Fromage fondu, préparation, cheddar, conditionné à froid",0.3
52,"Cheese, processed food, swiss, loaf","Fromage fondu, préparation, Suisse, pain",0.20833
54,"Cream, whipped, cream topping, pressurized","Crème, garniture fouettée, sous pression (bombe)",0.15215
55,"Eggnog, 7% M.F., Canadian product, 4% to 8% M.F.","Lait de poule, 7% M.G., produit canadien, 4% à 8% M.G.",0.9
56,"Coffee whitener (non dairy), liquid","Colorant à café (non laitier), liquide",0.15
57,"Dessert topping (non dairy), powdered","Garniture à dessert (non laitière), poudre",0.4966
58,"Dessert topping (non dairy), powdered, prepared with whole milk","Garniture à dessert (non laitière), poudre, préparée avec lait entier",0.15
59,"Dessert topping (non dairy), pressurized","Garniture à dessert (non laitière), sous pression (bombe)",0.15
60,"Dessert topping (non dairy), frozen, semisolid","Garniture à dessert (non laitière), congelée, semi-solide",0.15
61,"Milk, fluid, partly skimmed, 2% M.F.","Lait, partiellement écrémé, liquide, 2% M.G.",2.57819
63,"Milk, fluid, partly skimmed, 1% M.F.","Lait, liquide, partiellement écrémé, 1% M.G.",2.57819
66,"Milk, dry whole","Lait, poudre, entier",0.25
67,"Milk, dry, buttermilk, sweet cream","Babeurre, poudre, crème douce",0.07608
68,"Milk, condensed, sweetened, canned","Lait, concentré, sucré, conserve",0.38797
69,"Milk, fluid, chocolate, whole","Lait, liquide, chocolat, entier",2.64159
70,"Milk, fluid, chocolate, partly skimmed, 2% M.F.","Lait, liquide, chocolat, partiellement écrémé, 2% M.G.",2.64159
71,"Hot chocolate, cocoa, homemade, prepared with 2% milk","Chocolat chaud, cacao, fait maison, préparé avec lait 2% m.g.",1.8491
72,"Milk, fluid, goat, enriched, whole","Lait, liquide, chèvre, enrichi, entier",2.57819
73,"Milk, fluid, human (breast milk), mature","Lait, liquide, humain (lait maternel), mature, entier",2.59932
74,"Milk, fluid, sheep, whole","Lait, liquide, brebis, entier",2.58876
75,"Milk shake, chocolate, thick","Lait frappé, chocolat, épais",2.4008
76,"Milk shake, vanilla, thick","Lait frappé, vanille, épais",2.4008
77,"Whey, acid, fluid","Lactoserum, acide, liquide",2.59932
78,"Whey, acid, dry","Lactoserum, acide, poudre",0.03614
79,"Whey, sweet, fluid","Lactoserum, sucré, liquide",2.59932
80,"Whey, sweet, dry","Lactoserum, sucré, poudre",0.09193
83,"Egg, chicken, dried, whole","Oeuf, poule, déshydraté, entier",0.05388
84,"Egg, chicken, dried, whole, stabilized","Oeuf, poule, déshydraté, entier, stabilisé",0.05388
85,"Egg, chicken, white, pan dried, flakes","Oeuf, poule, blanc, séché, flocons",
86,"Egg, chicken, white, dried, powder, glucose reduced","Oeuf, poule, blanc, déshydraté, poudre, réduit en glucose",1.1306
87,"Egg, chicken, yolk, dried","Oeuf, poule, jaune, déshydraté",0.04248
88,"Egg, duck, whole, fresh, raw","Oeuf, canard, entier, frais, cru",0.5
89,"Egg, goose, whole, fresh, raw","Oeuf, oie, entier, frais, cru",0.72
90,"Egg, quail, whole, fresh, raw","Oeuf, caille, entier, frais, cru",0.9
91,"Egg, turkey, whole, fresh, raw","Oeuf, dinde, entier, frais, cru",0.79
92,"Butter, unsalted","Beurre, sans sel",1.135
93,"Cheese, parmesan, shredded","Fromage parmesan, râpé en filaments",1.0566
96,"Cheese, goat, hard, (less than 35% water, 36% M.F.)","Fromage chèvre, dur, (moins de 35% eau, 36% M.G.)",1.585
97,"Cheese, goat, semi-soft, (35% to 55% water, 30% M.F.)","Fromage de chèvre, semi-mou, (35% à 55% eau, 30% M.G.)",1.585
98,"Cheese, goat, soft, (more than 55% water, 21% M.F.)","Fromage de chèvre, mou, (plus de 55% eau, 21% M.G.)",1.585
100,Cheese fondue,Fondue au fromage,0.54523
101,"Cheese sauce, homemade","Fromage, sauce, faite maison",0.61623
102,"Cheese, Mexican, queso anejo","Fromage mexicain, queso anejo",0.3
103,"Cheese, Mexican, queso asadero","Fromage mexicain, queso asadero",0.3
104,"Cheese, Mexican, queso chihuahua","Fromage Mexicain, queso chihuahua",0.3
105,"Cheese, cheddar or colby type, low fat (7% M.F.)","Fromage, type cheddar ou colby, faible en gras (7% M.G.)",0.3
106,"Cheese, cheddar or colby type, low sodium","Fromage, type cheddar ou colby, faible en sodium",0.3
107,"Cheese, cottage, (1% M.F.)","Fromage cottage, (1% M.G.)",1.25
108,"Cheese, feta",Fromage féta,0.3
109,"Cheese, gouda",Fromage gouda,0.3
110,"Cheese, mozzarella, (52% water, 22.5% M.F.)","Fromage mozzarella, (52% eau, 22.5% M.G.)",0.3
111,"Cheese, mozzarella, partially skim, (52% water, 16.5% M.F.)","Fromage mozzarella, partiellement écrémé, (52% eau, 16.5% M.G.)",0.3
112,"Milk, evaporated, skim, canned, undiluted, 0.2% M.F.","Lait, concentré, écrémé, conserve, non dilué, 0.2% M.G.",1.33136
113,"Milk, fluid, whole, pasteurized, homogenized, 3.25% M.F.","Lait, liquide, entier, homogénéisé, pasteurisé, 3.25% M.G.",2.57819
114,"Milk, fluid, skim","Lait, liquide, écrémé",2.58876
115,"Milk, dry, skim, powder, instant","Lait, poudre, écrémé, instant",0.01447
116,"Hot chocolate, cocoa, homemade, prepared with whole milk","Chocolat chaud, cacao, fait maison, préparé avec lait entier",1.8491
117,"Egg substitute, frozen (yolk replaced)","Oeuf, succédané, congelé (jaune remplacé)",1.26796
118,"Butter, regular","Beurre, salé",1.135
119,"Cheese, cheddar",Fromage cheddar,0.3
120,"Cheese, cottage, (2% M.F.)","Fromage cottage, (2% M.G.)",1.25
122,"Coffee whitener (non dairy), powdered","Colorant à café (non laitier), en poudre",0.01987
123,"Milk, fluid, whole, producer, 3.7% M.F.","Lait, liquide, entier, agriculteur, 3.7% M.G.",2.57819
124,"Milk, fluid, buttermilk, cultured, 1% M.F.","Babeurre, liquide, culture, 1% M.G.",2.58876
125,"Egg, chicken, whole, fresh or frozen, raw","Oeuf, poule, entier, frais ou congelé, cru",0.3349
126,"Egg, chicken, white, fresh or frozen, raw","Oeuf, poule, blanc, frais ou congelé, cru",0.238
127,"Egg, chicken, yolk, fresh or frozen, raw","Oeuf, poule, jaune, frais ou congelé, cru",0.25
129,"Egg, chicken, whole, cooked, fried","Oeuf, poule, entier, cuit, frit",0.92
130,"Egg, chicken, whole, cooked, boiled in shell, hard-cooked","Oeuf, poule, entier, cuit, bouilli à la coque, dur",1.0
132,"Egg, chicken, whole, cooked, poached","Oeuf, poule, entier, cuit, poché",1.0
133,"Egg, chicken, whole, cooked, scrambled or omelet","Oeuf, poule, entier, cuit, brouillé ou omelette",1.22
134,"Milk, dry, skim, powder, regular","Lait, en poudre, écrémé",0.25
136,"Cream, table (coffee), 18% M.F.","Crème à café (crème de table), 18% M.G.",1.26796
137,"Cream, whipping, 32% M.F.","Crème à fouetter, 32% M.G.",0.15
138,"Cream, whipping, 35% M.F.","Crème à fouetter, 35% M.G.",0.15
139,"Cream, sour, cultured, 14% M.F","Crème sure, de culture, 14% M.G.",0.29164
140,"Milk, evaporated, whole, canned, undiluted, 7.8% M.F.","Lait, concentré, entier, conserve, non dilué, 7,8% M.G.",0.15976
147,"Cheese, cottage, uncreamed, dry, large or small curd, nonfat","Fromage cottage sec, pressé, sans gras, gros et petit grain",1.25
150,"Cream, cereal (half and half), 10% M.F.","Crème à céréales (moitié-moitié), 10% M.G.",1.27852
151,"Cream, table (coffee), 15% M.F.","Crème, à café (de table), 15% M.G.",1.26796
152,"Cream, sour, cultured, 18% M.F.","Crème sure, de culture, 18% M.G.",0.29164
153,"Milk, evaporated, partly skimmed, canned, undiluted, 2% M.F.","Lait, concentré, partiellemente écrémé, conserve, non dilué, 2% M.G.",0.15976
160,"Cheese, calorie-reduced (6% M.F.)","Fromage, réduit en calories (6% M.G.)",0.3
163,"Cream, table (coffee), 20% M.F.",Crème de table (à café) 20% M.G.,1.26797
164,"Dessert, frozen yogourt","Dessert, congelé, yogourt glacé",0.91927
169,"Spices, allspice, ground","Épices, piments de la jamaïque, moulu",0.005
170,"Spices, anise seeds","Épices, anis, graines",0.005
171,"Spices, basil, dried","Épices, basilic, déshydraté",0.005
172,"Spices, bay leaf","Épices, laurier, feuilles",0.005
173,"Spices, caraway seed","Épices, carvi, graines",0.005
174,"Spices, cardamom, ground","Épices, cardamome, moulue",0.005
175,"Spices, celery seed","Épices, céleri, graines",0.005
176,"Spices, chervil, dried","Épices, cerfeuil, déshydraté",0.005
177,"Spices, chili powder","Épices, chili, poudre",0.005
178,"Spices, cinnamon, ground","Épices, cannelle, moulue",0.005
179,"Spices, cloves, ground","Épices, clou de girofle, moulu",0.02198
180,"Spices, coriander leaf (cilantro), dried","Épices, coriandre (cilantro), feuilles, déshydraté",0.005
181,"Spices, coriander seed (cilantro)","Épices, coriandre (cilantro), graines",0.005
182,"Spices, cumin seed","Épices, cumin, graines",0.005
183,"Spices, curry powder","Épices, cari, poudre",0.005
184,"Spices, dill seed","Épices, aneth, graines",0.005
185,"Spices, dill weed, dried","Épices, aneth, déshydraté",0.005
186,"Spices, fennel seed","Épices, fenouil, graines",0.005
187,"Spices, fenugreek seed","Épices, fenugrec, graines",0.005
188,"Spices, garlic powder","Épices, ail, poudre",0.005
189,"Spices, ginger, ground","Épices, gingembre, moulu",0.005
190,"Spices, mace, ground","Épices, macis, moulu",0.005
191,"Spices, marjoram, dried","Épices, marjolaine, déshydratée",0.005
192,"Spices, mustard seed, yellow","Épices, graines de moutarde, jaunes",0.005
193,"Spices, nutmeg, ground","Épices, muscade, moulue",0.005
194,"Spices, onion powder","Épices, oignon, poudre",0.005
195,"Spices, oregano, ground","Épices, origan, moulu",0.005
196,"Spices, paprika","Épices, paprika",0.005
197,"Spices, parsley, dried","Épices, persil, déshydraté",0.005
198,"Spices, pepper, black","Épices, poivre, noir",0.02942
199,"Spices, pepper, red or cayenne","Épices, piment rouge ou de cayenne",0.005
200,"spices, pepper, white","Épices, poivre, blanc",0.005
201,"Spices, poppy seed","Épices, pavot, graines",0.005
202,"Spices, poultry seasoning","Épices, assaisonnement pour volaille",0.005
203,"Spices, pumpkin pie spice","Épices, assaisonnement pour tarte à la citrouille",0.005
204,"Spices, rosemary, dried","Épices, romarin, déshydraté",0.005
205,"Spices, saffron","Épices, safran",0.005
206,"Spices, sage, ground","Épices, sauge, moulue",0.005
207,"Spices, savory, ground","Épices, sarriette, moulue",0.005
209,"Spices, tarragon, dried","Épices, estragon, déshydraté",0.005
210,"Spices, thyme, dried","Épices, thym, déshydraté",0.005
211,"Spices, turmeric, ground","Épices, curcuma, moulu",0.005
212,"Basil, fresh","Basilic, frais",0.03043
213,"Spices, dill weed, fresh","Épices, aneth, frais",0.005
214,"Salt, table","Sel, table",0.01
215,"Spices, thyme, fresh","Épices, thym, frais",0.005
216,Vanilla extract,"Vanille, extrait",0.04286
217,"Vanilla extract, imitation, with alcohol","Vanille, extrait, imitation, avec alcool",0.04286
218,"Vanilla extract, imitation, without alcohol","Vanille, extrait, imitation, sans alcool",0.04286
219,"Grains, barley, malt extract, dried","Grains céréaliers, orge, malt, extrait, déshydraté",0.45
232,"Babyfood, snack, biscuit, mixed grain","Aliments pour bébé, grignotises, biscuit, mélange de grains",0.1681
283,"Babyfood, cereal, barley, with milk powder, dry","Bébé, céréale, orge, avec poudre de lait, sèche",0.07
285,"Babyfood, cereal, mixed grain, dry","Bébé, céréale, mélange de grains, sèche",0.069
286,"Babyfood, cereal, mixed grain, prepared with formula or breast milk","Bébé, céréale, mélange de grains, préparée avec préparation pour nourrissons ou lait maternel",0.4478
287,"Babyfood, cereal, mixed grain, with milk powder and fruit, dry","Bébé, céréale, mélange de grains, avec poudre de lait et fruits, sèche",0.068
291,"Babyfood, cereal, oat, dry","Bébé, céréale, avoine, sèche",0.054
293,"Babyfood, cereal, rice, with milk powder and fruit, dry","Bébé, céréale, riz, avec poudre de lait et fruits, sèche",0.0644
394,"Babyfood, cereal, rice, dry","Bébé, céréale, riz, sèche",0.0559
414,"Animal fat, beef tallow","Gras animal, suif de boeuf (gras de boeuf)",0.1
415,"Sandwich spread, with chopped pickle, regular, unspecified oil","Tartinade pour sandwich, avec cornichons hachés, ordinaire, huile non spécifiée",0.30405
416,"Vegetable oil, rice bran","Huile végétale, son de riz",0.09214
417,"Vegetable oil, wheat germ","Huile végétale, germe de blé",0.09214
418,"Vegetable oil, peanut","Huile végétale, arachide",0.09129
419,"Vegetable oil, soybean","Huile végétale, soya",0.09214
420,"Vegetable oil, coconut","Huile végétale, noix de coco",0.09214
422,"Vegetable oil, olive","Huile végétale, olive",0.09129
423,"Vegetable oil, palm","Huile végétale, palme",0.09129
424,"Vegetable oil, sesame","Huile végétale, sésame",0.09214
426,"Salad dressing, french, homemade, unspecified oil","Vinaigrette, française, faite maison, huile non spécifiée",0.2838
428,"Salad dressing, oil and vinegar, homemade","Vinaigrette, huile et vinaigre, faite maison",0.32432
429,"Vegetable oil, cocoa butter","Huile végétale, beurre de cacao",0.09214
430,"Vegetable oil, cottonseed","Huile végétale, graine de coton",0.09214
432,"Vegetable oil, safflower, linoleic (70% and over)","Huile végétale, carthame, acide linoléique (70% et plus)",0.09214
433,"Vegetable oil, safflower, oleic (70% and over)","Huile végétale, carthame, acide oléique (70% et plus)",0.09214
434,"Vegetable oil, palm kernel","Huile végétale, palmiste",0.09214
435,"Vegetable oil, poppyseed","Huile végétale, graines de pavot",0.09214
436,"Vegetable oil, grapeseed","Huile végétale, pépins de raisin",0.09214
437,"Vegetable oil, corn","Huile végétale, maïs",0.9214
438,"Animal fat, mutton tallow","Gras animal, suif de mouton (gras de mouton)",0.1
439,"Vegetable oil, walnut","Huile végétale, noix",0.09214
440,"Vegetable oil, almond","Huile végétale, amande",0.09214
441,"Vegetable oil, apricot kernel","Huile végétale, noyaux d'abricots",0.09214
442,"Vegetable oil, soybean lecithin","Huile végétale, lécithine de soya",0.09214
443,"Vegetable oil, hazelnut","Huile végétale, noisette",0.09214
444,"Vegetable oil, babassu","Huile végétale, babassu",0.09214
445,"Animal fat, chicken","Gras animal, poulet",0.08664
446,"Shortening, household, soybean (hydrogenated) and palm","Shortening, domestique, huile de soya (hydrogénée) et palme",0.1
447,"Animal fat, duck","Gras animal, canard",0.1
448,"Animal fat, turkey","Gras animal, dinde",0.1
449,"Animal fat, goose","Gras animal, oie",0.1
450,"Vegetable oil, avocado","Huile végétale, avocat",0.09214
451,"Vegetable oil, canola","Huile végétale, canola (colza)",0.09214
452,"Vegetable oil, mustard","Huile végétale, moutarde",0.1
453,"Vegetable oil, sunflower, oleic (70% and over)","Huile végétale, tournesol, acide oléique (70% et plus)",0.1
454,"Shortening, special purpose, cake and icing (frosting)","Shortening, usagé déterminé, gâteau et glaçage",0.1
455,"Shortening, special purpose, baking","Shortening, usage déterminé, cuisson",0.1
456,"Vegetable oil, oat","Huile végétale, avoine",0.09214
457,"Fish oil, cod liver","Huile de poisson, foie de morue",0.09214
458,"Fish oil, herring","Huile de poisson, hareng",0.09214
459,"Fish oil, menhaden","Huile de poisson, menhaden",0.09214
460,"Fish oil, menhaden, fully hydrogenated","Huile de poisson, menhaden, entièrement hydrogénée",0.08664
461,"Fish oil, salmon","Huile de poisson, saumon",0.09214
462,"Fish oil, sardine","Huile de poisson, sardine",0.09214
463,"Shortening, multipurpose, hydrogenated soybean and palm","Shortening, tout usage, soya et palme hydrogéné",0.1
464,"Animal fat, lard (pork)","Gras animal, saindoux (porc)",0.1
523,"Shortening, industrial, for frying (liquid), soybean","Shortening, industriel, friture (liquide), soya",2.3035
524,"Salad dressing, russian, commercial, regular","Vinaigrette, russe, commerciale, régulière",0.31066
525,"Salad dressing, russian, commercial, low calorie","Vinaigrette, russe, commerciale, hypocalorique",0.32967
526,"Salad dressing, thousand island, commercial, regular","Vinaigrette, mille îles, commerciale, régulière",0.31699
527,"Salad dressing, mayonnaise type, commercial, regular","Vinaigrette, type mayonnaise, commerciale, régulière",2.48309
528,"Salad dressing, french, commercial, low calorie","Vinaigrette, française, commerciale, hypocalorique",0.32967
529,"Salad dressing, italian, commercial, low Calorie","Vinaigrette, italienne, commerciale, hypocalorique",0.30431
530,"Salad dressing, thousand island, commercial, low calorie","Vinaigrette, commerciale, mille Îles, hypocalorique",0.31065
531,"Salad dressing, mayonnaise, commercial, regular","Vinaigrette, mayonnaise, commerciale, régulière",0.2797
532,"Salad dressing, italian, commercial, regular","Vinaigrette, italienne, commerciale, régulière",0.29797
533,"Salad dressing, french, commercial, regular","Vinaigrette, française, commerciale, régulière",0.31699
534,"Salad dressing, blue or roquefort cheese, commercial, regular","Vinaigrette, fromage bleu ou roquefort, commerciale, régulière",0.31065
535,"Animal fat, native, seal oil","Gras animal,  autochtone, huile de phoque",0.0959
539,"Shortening, household, unspecified vegetable and animal oils","Shortening, domestique, huiles végétales et animales non précisées",0.1
540,"Shortening, industrial, for frying (liquid), canola","Shortening, industriel, friture (liquide), canola",0.0459
541,"Shortening, industrial, for frying (solid), canola","Shortening, industriel, friture (solide), canola",0.1
542,"Shortening, industrial, for frying (solid), soybean","Shortening, industriel, friture (solide), soya",0.1
543,"Shortening, industrial, for baking (cake), canola","Shortening, industriel, pour cuisson (gâteau), canola",0.1
544,"Shortening, industrial, for baking (cake), soybean","Shortening, industriel, pour cuisson (gâteau), soya",0.1
545,"Shortening, industrial, for baking (pastry), canola","Shortening, industriel, pour cuisson (pâtisserie), canola",0.1
546,"Shortening, industrial, for baking (pastry), soybean","Shortening, industriel, pour cuisson (pâtisserie), soya",0.1
547,"Shortening, industrial, all purpose, soy and palm","Shortening, industriel, tout usage, soya et palme",0.1
548,"Shortening, industrial, all purpose, canola and palm","Shortening, industriel, tout usage, canola et palme",0.1
550,"Spread, 20% butter / 80% canola oil","Tartinade, mélange, 20% beurre / 80% canola oil",0.04704
552,"Shortening, household, unspecified vegetable oil","Shortening, domestique, huile végétale non précisée",0.1
555,"Chicken, broiler, meat, skin, giblets and neck, raw","Poulet à griller, viande, peau, abats et cou, cru",1.25
556,"Chicken, broiler, meat, skin, giblets and neck, batter dipped, fried","Poulet à griller, viande, peau, abats et cou, pâte à frire, frits",1.0
557,"Chicken, broiler, meat, skin, giblets and neck, flour coated, fried","Poulet à griller, viande, peau, abats et cou, enfarinés, frits",1.0
558,"Chicken, broiler, meat, skin, giblets and neck, roasted","Poulet à griller, viande, peau, abats et cou, rôtis",1.0
559,"Chicken, broiler, meat, skin, giblets and neck, stewed","Poulet à griller, viande, peau, abats et cou, à l'étuvée",1.0
560,"Chicken, broiler, meat and skin, raw","Poulet à griller, viande et peau, crues",1.25
561,"Chicken, broiler, meat and skin, batter dipped, fried","Poulet à griller, viande et peau, pâte à frire frites",1.0
562,"Chicken, broiler, meat and skin, flour coated, fried","Poulet à griller, viande et peau, enfarinées, frites",1.0
563,"Chicken, broiler, meat and skin, roasted","Poulet à griller, viande et peau, rôti",1.0
564,"Chicken, broiler, meat and skin, stewed","Poulet à griller, viande et peau, à l'étuvée",1.4265
565,"Chicken, broiler, meat only, raw","Poulet à griller, viande seulement, cru",1.25
566,"Chicken, broiler, meat only, fried","Poulet à griller, viande seulement, frite",1.42645
567,"Chicken, broiler, meat only, roasted","Poulet à griller, viande seulement, rôti",1.42645
568,"Chicken, broiler, meat only, stewed","Poulet à griller, viande seulement, à l'étuvée",1.42645
569,"Chicken, broiler, skin only, batter dipped, fried","Poulet à griller, peau seulement, pâte à frire, frit",0.55
570,"Chicken, broiler, skin only, flour coated, fried","Poulet à griller, peau seulement, enfariné, frit",0.55
571,"Chicken, broiler, giblets, raw","Poulet à griller, abats, cru",1.25
572,"Chicken, broiler, giblets, flour coated, fried","Poulet à griller, abats, enfariné, frit",1.0
573,"Chicken, broiler, giblets, simmered","Poulet à griller, abats, mijoté",1.0
574,"Chicken, broiler, gizzard, raw","Poulet à griller, gésier, cru",1.25
575,"Chicken, broiler, gizzard, simmered","Poulet à griller, gésier, mijoté",1.0
576,"Chicken, broiler, heart, raw","Poulet à griller, coeur, cru",1.25
577,"Chicken, broiler, heart, simmered","Poulet à griller, coeur, mijoté",1.0
578,"Chicken, broiler, liver, raw","Poulet à griller, foie, cru",1.25
579,"Chicken, broiler, liver, simmered","Poulet à griller, foie, mijoté",1.0
580,"Chicken, broiler, light meat and skin, raw","Poulet à griller, viande blanche et peau, cru",1.25
581,"Chicken, broiler, light meat and skin, batter dipped, fried","Poulet à griller, viande blanche et peau, pâte à frire, frit",1.42645
582,"Chicken, broiler, light meat and skin, flour coated, fried","Poulet à griller, viande blanche et peau, enfarinées, frit",1.42645
583,"Chicken, broiler, light meat and skin, roasted","Poulet à griller, viande blanche et peau, rôti",1.42645
584,"Chicken, broiler, light meat and skin, stewed","Poulet à griller, viande blanche et peau,  à l'étuvée",1.42645
585,"Chicken, broiler, dark meat and skin, raw","Poulet à griller, viande brune et peau, cru",1.25
586,"Chicken, broiler, dark meat and skin, batter dipped, fried","Poulet à griller, viande brune et peau, pâte à frire, frit",1.42645
587,"Chicken, broiler, dark meat and skin, flour coated, fried","Poulet à griller, viande brune et peau, enfarinées, frit",1.42645
588,"Chicken, broiler, dark meat and skin, roasted","Poulet à griller, viande brune et peau, rôties",1.42645
589,"Chicken, broiler, dark meat and skin, stewed","Poulet à griller, viande brune et peau, à l'étuvée",1.42645
590,"Chicken, broiler, light meat, raw","Poulet à griller, viande blanche, crue",1.42645
591,"Chicken, broiler, light meat, fried","Poulet à griller, viande blanche, frite",1.42645
592,"Chicken, broiler, light meat, roasted","Poulet à griller, viande blanche, rôtie",1.42645
593,"Chicken, broiler, light meat, stewed","Poulet à griller, viande blanche,  à l'étuvée",1.42645
594,"Chicken, broiler, dark meat, raw","Poulet à griller, viande brune, crue",1.25
595,"Chicken, broiler, dark meat, fried","Poulet à griller, viande brune, frite",1.42645
596,"Chicken, broiler, dark meat, roasted","Poulet à griller, viande brune, rôtie",1.42645
597,"Chicken, broiler, dark meat, stewed","Poulet à griller, viande brune, à l'étuvée",1.42645
598,"Chicken, broiler, back, meat and skin, batter dipped, fried","Poulet à griller, dos, viande et peau, pâte à frire, frit",1.42645
599,"Chicken, broiler, back, meat and skin, flour coated, fried","Poulet à griller, dos, viande et peau, enfarinées, frit",1.42645
