FoodID,FoodDescription,FoodDescriptionF,ConversionFactorValue
5866,"Chili without beans, canned","Chili sans haricots, conserve",2.68385
5867,"Spaghetti, with meatballs in tomato sauce, canned","Spaghetti avec boulettes de viande dans une sauce aux tomates, conserve",2.59946
5868,"Spaghetti, without meat, canned","Spaghetti sans viande, conserve",1.00597
5869,"Lasagna with meat and sauce, low fat, frozen","Lasagne avec viande et sauce, faible en gras, congelée",1.95
5870,"Lasagna with meat and sauce, frozen","Lasagne avec viande et sauce, congelée",1.95
5871,"Agutuk, native, fish/berry with seal oil (Alaskan ice cream)","Agutuk, autochtone, poisson/baie avec huile de phoque (Crème glacée alaskienne)",1.0
5872,"Agutuk, native, fish with shortening (Alaskan ice cream)","Agutuk, autochtone, poisson avec shortening (Crème glacée alaskienne)",1.0
5873,"Game meat, native, agutuk, meat-caribou (Alaskan ice cream)","Gibier, viande, autoch, agutuk, viande de caribou (crème glacée alaskienne)",1.0
5874,"Ascidians, native (tunughnak)","Ascidies, autochtone (tunughnak)",1.25
5875,"Game meat, native, beluga, eyes, raw","Gibier, viande, autochtone, béluga, yeux, crus",1.25
5876,"Game meat, native, beluga, flipper, raw","Gibier, viande, autochtone, béluga, nageoire, crue",1.25
5877,"Game meat, native, beluga, liver, raw","Gibier, viande, autochtone, béluga, foie, cru",1.25
5879,"Fish, blackfish, native, whole","Poisson, bar noir (mérou noir), autochtone, entier",1.25
5881,"Chiton, leathery, gumboots, native","Chiton, ""leathery, gumboots"", autochtone",1.25
5882,"Fish, devilfish, native, meat","Poisson, diable de mer (Mante), autochtone, viande",1.25
5883,"Fireweed, native, young leaves, raw","Épilobe à feuilles étroites, autochtone, feuilles tendres, crues",
5884,"Fish, herring eggs on giant kelp, native, Pacific","Poisson, oeufs de hareng, sur algue géante, autochtone, pacifique",1.25
5885,"Fish, herring eggs, native, Pacific, dry","Poisson, hareng, autochtone, oeufs, pacifique, déshydratés",0.55
5886,"Fish, herring eggs, native, Pacific, raw","Poisson, hareng, autochtone, oeufs, pacifique, crus",1.25
5887,"Fish, herring, native, Pacific, air-dried, packed in oil","Poisson, hareng, autochtone, pacifique, déshydraté, dans l`huile",0.35
5888,"Fish, lingcod, native, liver","Poisson, morue-lingue, autochtone, foie",1.25
5889,"Mashu roots, (sweetvetch) native, raw","Sinfoin alpin, racines, autochtone, crues",
5890,"Game meat, native, bearded seal, (oogruk), air-dried","Gibier, viande, autochtone, phoque barbu, (oogruk), déshydraté",0.35
5891,"Animal fat, native, bearded seal, oil (oogruk oil)","Gras animal, autochtone, phoque barbu, huile (oogruk)",0.1
5892,"Fish, oopah (tunicata), native, whole animal","Poisson, oopah (tunicata), autochtone, entier",1.25
5893,"Game meat, native, horned owl, raw","Gibier, viande, autochtone, hibou strié, cru",1.25
5894,"Fish, pike, northern, native, liver","Poisson, grand brochet, autochtone, foie",1.25
5895,"Fish, salmon, native, tipnuk, fermented","Poisson, saumon, autochtone, tipnuk, fermenté",1.0
5896,"Fish, salmon, native, king or chinook, kippered, canned","Poisson, saumon, autochtone, royal ou quinnat, légèrement salé et fumé, conserve",0.55
5897,"Fish, salmon, native, king or chinook, smoked, canned","Poisson, saumon, autochtone, royal ou quinnat, fumé, conserve",0.55
5898,"Fish, salmon, native, king or chinook, smoked, brined","Poisson, saumon, autochtone, royal ou quinnat, fumé, saumuré",1.0
5899,"Fish, salmon, native, king or chinook, liver","Poisson, saumon, autochtone, royal ou quinnat, foie",1.25
5900,"Sourdock (sorrel), native, young leaves","Rumex petite-oseille, autochtone, feuilles tendres",
5901,"Game meat, native, walrus, dry","Gibier, viande, autochtone, morse, déshydraté",0.55
5902,"Game meat, native, deer (venison), sitka, raw","Gibier, viande, autochtone, cerf de Sitka (venaison), cru",1.25
5903,"Game meat, native, walrus, liver, raw","Gibier, viande, autochtone, morse, foie, cru",1.25
5904,"Animal fat, native, walrus, oil","Gras animal, autochtone, morse, huile",0.1
5905,"Game meat, native, bowhead, blubber","Gibier, viande, autochtone, baleine boréale, lard",1.25
5906,"Game meat, native, bowhead, muktuk","Gibier, viande, autochtone, baleine boréale, muktuk",1.25
5907,"Animal fat, native, bowhead, oil","Animal fat, autochtone, baleine boréale, huile",0.1
5908,"Willow, native, leaves in oil","Feuilles de saule, autochtone, dans l'huile",0.3
5909,"Willow, native, young leaves, chopped","Feuilles de saule, autochtone, tendres, hachées",0.65
5910,"Bread, 'fry bread', made with lard (Navajo)","Pain, frit (""fry bread"") avec saindoux, (Navajo)",1.36
5911,Tamale (Navajo),Tamale (Navajo),1.4
5912,"Fish, burbot (loche), native, liver, baked","Poisson, lotte (loche), autochtone, foie, cuit au four",1.0
5913,"Fish, burbot (loche), native, skin, raw","Poisson, lotte (loche), autochtone, peau, crue",1.25
5914,"Fish, burbot (loche), native, skin, baked","Poisson, lotte (loche), autochtone, peau, cuite au four",1.0
5915,"Fish, burbot (loche), native, head, baked","Poisson, lotte (loche), autochtone, tête, cuite au four",1.0
5916,"Grains, tapioca, pearl, cooked","Grains céréaliers, tapioca, perlé, cuit",1.4
5917,"Grains, quinoa, cooked","Grains céréaliers, quinoa, cuit",1.95477
5918,"Lentils, pink, boiled","Lentilles, roses, bouillies",1.7907
5919,"Fish, sculpin, native, raw","Poisson, chabot, autochtone, cru",1.25
5920,"Vermicelli, made from soy, cooked","Vermicelle de soya, cuits",2.15
5921,"Fish, cisco (lake herring, tullibee), native, smoked, dried","Poisson, cisco (hareng de lac), autochtone, fumé, déshydraté",0.35
5922,"Fish, cisco (lake herring, tullibee), native, baked","Poisson, cisco (hareng de lac), autochtone, cuit au four",1.0
5923,"Fish, whitefish, native, smoked, dried","Poisson, corégone de lac, autochtone, fumé, déshydraté",0.35
5924,"Fish, whitefish, native, smoked, baked","Poisson, corégone de lac, autochtone, fumées, au four",1.0
5925,"Fish, whitefish, native, eggs, baked","Poisson, corégone de lac, autochtone, oeufs, au four",1.0
5926,"Fish, whitefish, native, head, baked","Poisson, corégone de lac, autochtone, tête, au four",1.0
5927,"Fish, whitefish, native, esophagus, raw","Poisson, corégone de lac, autochtone, oesophage, cru",1.25
5928,"Fish, salmon, native, eggs, raw","Poisson, saumon, autochtone, oeufs, cru",1.25
5929,"Goose, wild (Canada goose), native, meat, smoked, dried","Bernache du canada (outarde), autochtone, viande, fumée, déshydratée",0.75
5930,"Goose, wild (Canada goose), native, meat and skin, dried, boiled","Bernache du canada (outarde), autochtone, viande et peau, déshydratée, bouillie",0.75
5931,"Duck, wild, native, cooked","Canard sauvage, autochtone, cuit",1.0
5932,"Ptarmigan, native, meat, raw","Lagopède, autochtone, viande, crue",1.25
5933,"Ptarmigan, native, meat, cooked","Lagopède, autochtone, viande, cuite",1.0
5934,"Spruce grouse, native, meat, raw","Tétras du Canada, autochtone, viande, crue",1.25
5935,"Spruce grouse, native, meat, cooked","Tétras du Canada, autochtone, viande, cuite",1.0
5936,"Netted willow, native, leaves, raw","Saule réticulé, autochtone, feuilles, crus",0.65
5937,"Mountain sorrel, native, leaves, raw","Rumex petite-oseille, autochtone, feuilles, crus",0.65
5938,"Black crowberry (curlewberry), native","Camarine noire, autochtone",1.4
5939,"Cloudberry (bakeapple), native","Chicouté, autochtone",1.4
5940,"Sea cucumber, native","Concombre de mer (holothurie), autochtone",1.25
5943,"Beef, chuck, cross rib roast, boneless, lean and fat, 0mm (0"") trim, raw","Boeuf, épaule, rôti de côtes croisées, désossé, maigre et gras, 0mm (0"") paré, cru",1.25
5944,"Beef, chuck, cross rib roast, boneless, lean and fat, 3mm (1/8"") trim, raw","Boeuf, épaule, rôti de côtes croisées, désossé, maigre et gras, 3mm (1/8"") paré, cru",0.9
5945,"Beef, chuck, blade roast, boneless, lean and fat, 3mm (1/8'') trim, raw","Boeuf, épaule, rôti de palette, désossé, maigre et gras, 3mm (1/8'') paré, cru",0.9
5946,"Beef, chuck, blade roast, boneless, lean, raw","Boeuf, épaule, rôti de palette, désossé, maigre, cru",0.9
5948,"Beef, chuck, blade roast, boneless, lean and fat, 3mm (1/8'') trim, cooked, braised","Boeuf, épaule, rôti de palette, désossé, maigre et gras, 3mm (1/8'') paré, cuit, braisé",0.75
5949,"Beef, chuck, blade roast, boneless, lean, cooked, braised","Boeuf, épaule, rôti de palette, désossé, maigre, cuit, braisé",0.75
5950,"Beef, chuck, blade steak, boneless, lean and fat, 0mm (0"") trim, raw","Boeuf, épaule, bifteck de palette, désossé, maigre et gras, 0mm (0"") paré, cru",0.9
5952,"Beef, chuck, blade steak, boneless, lean, raw","Boeuf, épaule, bifteck de palette, désossé, maigre, cru",0.9
5955,"Beef, chuck, blade steak, with bone, lean, cooked, braised","Boeuf, épaule, bifteck de palette, avec os, maigre, cuit, braisé",0.75
5956,"Clementine, raw","Clémentine, crue",1.4
5957,"Mushroom, portabella (portobello), grilled","Champignon, portobella (portobello), grillé",1.2785
5958,"Mushroom, white, stir-fried, no fat added","Champignon, sauté, sans gras ajouté",0.85
5959,"Mushroom, shiitake, stir-fried, no fat added","Champignon, shiitake, sauté, sans gras ajouté",1.53213
5960,"Onion, yellow, sauteed","Oignon, jaune, sauté",0.85
5961,"Sports drink, orange flavour, powder","Boisson pour sportifs, saveur orange, poudre",0.23
5962,"Sports drink, fruit flavour, ready-to-drink","Boisson pour sportifs, saveur fruits, prête-à-boire",2.57819
5963,"Sports drink, lemon-lime flavour, ready-to-drink","Boisson pour sportifs, saveur citron et lime, prête-à-boire",2.57819
5965,"Fish, salmon, pink, canned, drained solids with bone","Poisson, saumon, rose, conserve, chair avec arêtes",0.55
5966,"Fish, tilapia, raw","Poisson, tilapia, cru",1.25
5967,"Fish, tilapia, baked or broiled","Poisson, tilapia, au four ou grillé",1.0
5968,"Veggie / soy burger patty, unprepared","Hambourgeois végétarien / soya, galette, non préparée",1.5
5969,"Waffle, buttermilk, frozen, ready-to-heat","Gaufre, babeurre, congelée, prête-à-chauffer",0.75
5970,"Waffle, buttermilk, frozen, ready-to-heat, toasted","Gaufre, babeurre, congelée, prête-à-chauffer, grillée",0.75
5971,"Waffle, buttermilk, frozen, ready-to-heat, microwaved","Gaufre, babeurre, congelée, prête-à-chauffer, cuite au four à micro-ondes",0.75
5972,"Waffle, plain, frozen, ready-to-heat, microwaved","Gaufre, nature, congelée, prête-à-cuire, cuite au four à micro-ondes",0.75
5973,"Pancake, plain (includes buttermilk), frozen, ready-to-heat, microwave","Crêpe, nature, (avec babeurre), congelée, prête-à-chauffer, cuite au four à micro-ondes",0.75
5974,"Sweetener, aspartame, EQUAL","Édulcorant, aspartame, EQUAL",0.01
5975,"Sweetener, sucralose, SPLENDA","Édulcorant, sucralose, SPLENDA",0.005
5977,"Sweetener, saccharin","Édulcorant, saccharine",0.01
5978,"Sweets, sugars, fructose, powder","Confiseries, sucre, fructose, poudre",0.04
5979,"Dessert, frozen, ice cream, chocolate or caramel covered, with nuts","Dessert, congelé, crème glacée, enrobage de chocolat ou caramel, avec noix",0.54
5980,"Sweets, sugars, fructose, liquid","Confiseries, sucre, fructose, liquide",0.3851
5981,"Beef, chuck, cross rib roast, boneless, lean, raw","Boeuf, épaule, rôti de côtes croisées, désossé, maigre, cru",1.25
5982,"Beef, chuck, cross rib roast, boneless, lean and fat, 0mm (0"") trim, cooked, braised","Boeuf, épaule, rôti de côtes croisées, désossé, maigre et gras, 0mm (0"") paré, cuit, braisé",1.0
5983,"Beef, chuck, cross rib roast, boneless, lean and fat, 3mm (1/8"") trim, cooked, braised","Boeuf, épaule, rôti de côtes croisées, désossé, maigre et gras, 3mm (1/8"") paré, cuit, braisé",0.75
5984,"Beef, chuck, cross rib roast, boneless, lean, cooked, braised","Boeuf, épaule, rôti de côtes croisées, désossé, maigre, cuit, braisé",1.416
5989,"Beef, chuck, cross rib steak, boneless, lean and fat, 3mm (1/8"") trim, cooked, braised","Boeuf, épaule, bifteck de côtes croisées, désossé, maigre et gras, 3mm (1/8"") paré, cuit, braisé",1.416
5990,"Beef, chuck, cross rib steak, boneless, lean, cooked, braised","Boeuf, épaule, bifteck de côtes croisées, désossé, maigre, cuit, braised",1.416
5991,"Beef, hip, eye of round roast, boneless, lean and fat, 0mm (0"") trim, raw","Boeuf, cuisse, rôti de noix de ronde, désossé, maigre et gras, 0mm (0"") paré, cru",1.25
5993,"Beef, hip, eye of round roast, boneless, lean, raw","Boeuf, cuisse, rôti de noix de ronde, désossé, maigre, cru",1.25
5994,"Beef, hip, eye of round roast, boneless, lean and fat, 0mm (0"") trim, cooked, roasted","Boeuf, cuisse, rôti de noix de ronde, désossé, maigre et gras, 0mm (0"") paré, cuit, rôti",1.416
5996,"Beef, hip, eye of round roast, boneless, lean, cooked, roasted","Boeuf, cuisse, rôti de noix de ronde, désossé, maigre, cuit, rôti",1.416
5997,"Beef, hip, eye of round steak, boneless, lean and fat, 0mm (0"") trim, raw","Boeuf, cuisse, bifteck de noix de ronde, désossé, maigre et gras, 0mm (0"") paré, cru",1.25
5999,"Beef, hip, eye of round steak, boneless, lean, raw","Boeuf, cuisse, bifteck de noix de ronde, désossé, maigre, cru",1.25
6000,"Beef, hip, eye of round steak, boneless, lean and fat, 0mm (0"") trim, cooked, braised","Boeuf, cuisse, bifteck de noix de ronde, désossé, maigre et gras, 0mm (0"") paré, cuit, braisé",1.416
6002,"Beef, hip, eye of round steak, boneless, lean, cooked, braised","Boeuf, cuisse, bifteck de noix de ronde, désossé, maigre, cuit, braisé",1.416
6018,"Beef, fat, raw","Boeuf, gras, cru",0.1
6019,"Beef, fat, cooked","Boeuf, gras, cuit",0.1
6020,"Beef, flank, flank steak, boneless, lean and fat, 0mm (0"") trim, raw","Boeuf, flanc, bifteck de flanc, désossé, maigre et gras, 0mm (0"") paré, cru",1.25
6022,"Beef, flank, flank steak, boneless, lean, raw","Boeuf, flanc, bifteck de flanc, désossé, maigre, cru",1.25
6023,"Beef, flank, flank steak, boneless, lean and fat, 0mm (0"") trim, cooked, braised","Boeuf, flanc, bifteck de flanc, désossé, maigre et gras, 0mm (0"") paré, cuit, braisé",1.416
6025,"Beef, flank, flank steak, boneless, lean, cooked, braised","Boeuf, flanc, bifteck de flanc, désossé, maigre, cuit, braisé",1.416
6026,"Beef, hip, inside (top) round roast, boneless, lean and fat, 0mm (0"") trim, raw","Boeuf, cuisse, ronde, rôti d'intérieur, désossé, maigre et gras, 0mm (0"") paré, cru",1.25
6028,"Beef, hip, inside (top) round roast, boneless, lean, raw","Boeuf, cuisse, ronde, rôti d'intérieur, désossé, maigre, cru",1.25
6029,"Beef, hip, inside (top) round roast, boneless, lean and fat, 0mm (0"") trim, cooked, roasted","Boeuf, cuisse, ronde, rôti d'intérieur, désossé, maigre et gras, 0mm (0"") paré, cuit, rôti",1.416
6031,"Beef, hip, inside (top) round roast, boneless, lean, cooked, roasted","Boeuf, cuisse, ronde, rôti d'intérieur, désossé, maigre, cuit, rôti",1.416
6032,"Beef, hip, inside (top) round steak, boneless, lean and fat, 0mm (0"") trim, raw","Boeuf, cuisse, ronde, bifteck d'intérieur, désossé, maigre et gras, 0mm (0"") paré, cru",1.25
6033,"Beef, hip, inside (top) round steak, boneless, lean and fat, 3mm (1/8"") trim, raw","Boeuf, cuisse, ronde, bifteck d'intérieur, désossé, maigre et gras, 3mm (1/8"") paré, cru",1.25
6034,"Beef, hip, inside (top) round steak, boneless, lean, raw","Boeuf, cuisse, ronde, bifteck d'intérieur, désossé, maigre, cru",1.25
6035,"Beef, hip, inside (top) round steak, boneless, lean and fat, 0mm (0"") trim, cooked, braised","Boeuf, cuisse, ronde, bifteck d'intérieur, désossé, maigre et gras, 0mm (0"") paré, cuit, braisé",1.416
6036,"Beef, hip, inside (top) round steak, boneless, lean and fat, 3mm (1/8"") trim, cooked, braised","Boeuf, cuisse, ronde, bifteck d'intérieur, désossé, maigre et gras, 3mm (1/8"") paré, cuit, braisé",1.416
6037,"Beef, hip, inside (top) round steak, boneless, lean, cooked, braised","Boeuf, cuisse, ronde, bifteck d'intérieur, désossé, maigre, cuit, braisé",1.416
6038,"Cheese, cheddar, reduced fat (18%)","Fromage cheddar, teneur réduite en gras (18%)",0.3
6039,"Beef, hip, outside (bottom) round roast, boneless, lean and fat, 0mm (0"") trim, raw","Boeuf, cuisse, ronde, rôti d'extérieur, désossé, maigre et gras, 0mm (0"") paré, cru",1.25
6040,"Beef, hip, outside (bottom) round roast, boneless, lean and fat, 3mm (1/8"") trim, raw","Boeuf, cuisse, ronde, rôti d'extérieur, désossé, maigre et gras, 3mm (1/8"") paré, cru",1.25
6041,"Beef, hip, outside (bottom) round roast, boneless, lean, raw","Boeuf, cuisse, ronde, rôti d'extérieur, désossé, maigre, cru",1.25
6042,"Beef, hip, outside (bottom) round roast, boneless, lean and fat, 0mm (0"") trim, cooked, roasted","Boeuf, cuisse, ronde, rôti d'extérieur, désossé, maigre et gras, 0mm (0"") paré, cuit, rôti",1.416
6043,"Beef, hip, outside (bottom) round roast, boneless, lean and fat, 3mm (1/8"") trim, cooked, roasted","Boeuf, cuisse, ronde, rôti d'extérieur, désossé, maigre et gras, 3mm (1/8"") paré, cuit, rôti",1.416
6044,"Beef, hip, outside (bottom) round roast, boneless, lean, cooked, roasted","Boeuf, cuisse, ronde, rôti d'extérieur, désossé, maigre, cuit, rôti",1.416
6045,"Beef, hip, outside (bottom) round steak, boneless, lean and fat, 0mm (0"") trim, raw","Boeuf, cuisse, ronde, bifteck d'extérieur, désossé, maigre et gras, 0mm (0"") paré, cru",1.25
6046,"Beef, hip, outside (bottom) round steak, boneless, lean and fat, 3mm (1/8"") trim, raw","Boeuf, cuisse, ronde, bifteck d'extérieur, désossé, maigre et gras, 3mm (1/8"") paré, cru",0.9
6048,"Beef, hip, outside (bottom) round steak, boneless, lean and fat, 0mm (0"") trim, cooked, braised","Boeuf, cuisse, ronde, bifteck d'extérieur, désossé, maigre et gras, 0mm (0"") paré, cuit, braisé",1.416
6049,"Beef, hip, outside (bottom) round steak, boneless, lean and fat, 3mm (1/8"") trim, cooked, braised","Boeuf, cuisse, ronde, bifteck d'extérieur, désossé, maigre et gras, 3mm (1/8"") paré, cuit, braisé",0.75
6050,"Beef, hip, outside (bottom) round steak, boneless, lean, cooked, braised","Boeuf, cuisse, ronde, bifteck d'extérieur, désossé, maigre, cuit, braisé",1.416
6061,"Beef, rib, rib eye roast, boneless, lean and fat, 3mm (1/8"") trim, raw","Boeuf, côte, rôti de faux-filet, désossé, maigre et gras, 3mm (1/8"") paré, cru",0.9
6062,"Beef, rib, rib eye roast, boneless, lean, raw","Boeuf, côte, rôti de faux-filet, désossé, maigre, cru",0.9
6064,"Beef, rib, rib eye roast, boneless, lean and fat, 3mm (1/8"") trim, cooked, roasted","Boeuf, côte, rôti de faux-filet, désossé, maigre et gras, 3mm (1/8"") paré, cuit, rôti",0.75
6065,"Beef, rib, rib eye roast, boneless, lean, cooked, roasted","Boeuf, côte, rôti de faux-filet, désossé, maigre, cuit, rôti",0.75
6066,"Beef, rib, rib eye steak, boneless, lean and fat, 0mm (0"") trim, raw","Boeuf, côte, bifteck de faux-filet, désossé, maigre et gras, 0mm (0"") paré, cru",0.9
6068,"Beef, rib, rib eye steak, boneless, lean, raw","Boeuf, côte, bifteck de faux-filet, désossé, maigre, cru",0.9
6069,"Beef, rib, rib eye steak, boneless, lean and fat, 0mm (0"") trim, cooked, broiled","Boeuf, côte, bifteck de faux-filet, désossé, maigre et gras, 0mm (0"") paré, cuit, grillé",0.75
6071,"Beef, rib, rib eye steak, boneless, lean, cooked, broiled","Boeuf, côte, bifteck de faux-filet, désossé, maigre, cuit, grillé",0.75
6078,"Beef, rib, rib roast with bone, lean and fat, 3mm (1/8 "") trim, raw","Boeuf, côte, rôti de côte avec os, maigre et gras, 3mm (1/8 "") paré, cru",0.9
6079,"Beef, rib, rib roast with bone, lean, raw","Boeuf, côte, rôti de côte avec os, maigre, cru",0.9
6081,"Beef, rib, rib roast with bone, lean and fat, 3mm (1/8"") trim, cooked, roasted","Boeuf, côte, rôti de côte avec os, maigre et gras, 3mm (1/8"") paré, cuit, rôti",0.75
6082,"Beef, rib, rib roast with bone, lean, cooked, roasted","Boeuf, côte, rôti de côte avec os, maigre, cuit, rôti",0.75
6089,"Beef, hip, sirloin tip roast, boneless, lean and fat, 0mm (0"") trim, raw","Boeuf, cuisse, rôti de pointe de surlonge, désossé, maigre et gras, 0mm (0"") paré, cru",1.25
6090,"Beef, hip, sirloin tip roast, boneless, lean and fat, 3mm (1/8"") trim, raw","Boeuf, cuisse, rôti de pointe de surlonge, désossé, maigre et gras, 3mm (1/8"") paré, cru",1.25
6091,"Beef, hip, sirloin tip roast, boneless, lean, raw","Boeuf, cuisse, rôti de pointe de surlonge, désossé, maigre, cru",1.25
6092,"Beef, hip, sirloin tip roast, boneless, lean and fat, 0mm (0"") trim, cooked, roasted","Boeuf, cuisse, rôti de pointe de surlonge, désossé, maigre et gras, 0mm (0"") paré, cuit, rôti",1.416
6093,"Beef, hip, sirloin tip roast, boneless, lean and fat, 3mm (1/8"") trim, cooked, roasted","Boeuf, cuisse, rôti de pointe de surlonge, désossé, maigre et gras, 3mm (1/8"") paré, cuit, rôti",1.416
6094,"Beef, hip, sirloin tip roast, boneless, lean, cooked, roasted","Boeuf, cuisse, rôti de pointe de surlonge, désossé, maigre, cuit, rôti",1.416
6095,"Beef, hip, sirloin tip steak, boneless, lean and fat, 0mm (0"") trim, raw","Boeuf, cuisse, bifteck de pointe de surlonge, désossé, maigre et gras, 0mm (0"") paré, cru",1.25
6098,"Beef, hip, sirloin tip steak, boneless, lean and fat, 0mm (0"") trim, cooked, braised","Boeuf, cuisse, bifteck de pointe de surlonge, désossé, maigre et gras, 0mm (0"") paré, cuit, braisé",1.416
6102,"Beef, loin, strip loin roast, boneless, lean and fat, 3mm (1/8"") trim, raw","Boeuf, longe, rôti de contre-filet, désossé, maigre et gras, 3mm (1/8"") paré, cru",0.9
6105,"Beef, loin, strip loin roast, boneless, lean and fat, 3mm (1/8"") trim, cooked, roasted","Boeuf, longe, rôti de contre-filet, désossé, maigre et gras, 3mm (1/8"") paré, cuit, rôti",0.75
6107,"Beef, loin, strip loin (new york) steak, boneless, lean and fat, 0mm (0"") trim, raw","Boeuf, longe, bifteck de contre-filet, désossé, maigre et gras, 0mm (0"") paré, cru",1.25
6108,"Beef, loin, strip loin (new york) steak, boneless, lean and fat, 3mm (1/8"") trim, raw","Boeuf, longe, bifteck de contre-filet, désossé, maigre et gras, 3mm (1/8"") paré, cru",0.9
6109,"Beef, loin, strip loin (new york) steak, boneless, lean, raw","Boeuf, longe, bifteck de contre-filet, désossé, maigre, cru",1.25
6110,"Beef, loin, strip loin (new york) steak, boneless, lean and fat, 0mm (0"") trim, cooked, broiled","Boeuf, longe, bifteck de contre-filet, désossé, maigre et gras, 0mm (0"") paré, cuit, grillé",1.416
6111,"Beef, loin, strip loin (new york) steak, boneless, lean and fat, 3mm (1/8"") trim, cooked, broiled","Boeuf, longe, bifteck de contre-filet, désossé, maigre et gras, 3mm (1/8"") paré, cuit, grillé",0.75
6112,"Beef, loin, strip loin (new york) steak, boneless, lean, cooked, broiled","Boeuf, longe, bifteck de contre-filet, désossé, maigre, cuit, grillé",1.416
6114,"Beef, loin, t-bone steak (porterhouse), lean and fat, 3mm (1/8"") trim, raw","Boeuf, longe, bifteck d'aloyau (gros filet), maigre et gras, 3mm (1/8"") paré, cru",0.9
6115,"Beef, loin, t-bone steak (porterhouse), lean, raw","Boeuf, longe, bifteck d'aloyau (gros filet), maigre, cru",0.9
6117,"Beef, loin, t-bone steak (porterhouse), lean and fat, 3mm (1/8"") trim, cooked, broiled","Boeuf, longe, bifteck d'aloyau (gros filet), maigre et gras, 3mm (1/8"") paré, cuit, grillé",0.75
6118,"Beef, loin, t-bone steak (porterhouse), lean, cooked, broiled","Boeuf, longe, bifteck d'aloyau (gros filet), maigre, cuit, grillé",0.75
6119,"Pork, ground, lean, raw","Porc, haché, maigre, cru",1.0
6120,"Pork, ground, lean, pan-fried","Porc, haché, maigre, sauté",0.6
6121,"Pork, ground, medium, raw","Porc, haché, mi-maigre, cru",1.0
6122,"Pork, ground, medium, pan-fried","Porc, haché, mi-maigre, sauté",0.75
6123,"Beef, loin, tenderloin, roast, lean and fat, 0mm (0"") trim, raw","Boeuf, longe, filet, rôti, maigre et gras, 0mm (0"") paré, cru",1.25
6125,"Beef, loin, tenderloin, roast, lean, raw","Boeuf, longe, filet, rôti, maigre, cru",1.25
6126,"Beef, loin, tenderloin, roast, lean and fat, 0mm (0"") trim, cooked, roasted","Boeuf, longe, filet, rôti, maigre et gras, 0mm (0"") paré, cuit, rôti",1.416
6128,"Beef, loin, tenderloin, roast, lean, cooked, roasted","Boeuf, longe, filet, rôti, maigre, cuit, rôti",1.416
6129,"Beef, loin, tenderloin, steak, lean and fat, 0mm (0"") trim, raw","Boeuf, longe, filet, bifteck, maigre et gras, 0mm (0"") paré, cru",1.25
6131,"Beef, loin, tenderloin, steak, lean, raw","Boeuf, longe, filet, bifteck, maigre, cru",1.25
6132,"Beef, loin, tenderloin, steak, lean and fat, 0mm (0"") trim, cooked, broiled","Boeuf, longe, filet, bifteck, maigre et gras, 0mm (0"") paré, cuit, grillé",1.416
6134,"Beef, loin, tenderloin, steak, lean, cooked, broiled","Boeuf, longe, filet, bifteck, maigre, cuit, grillé",1.416
6137,"Beef, loin, top sirloin roast, boneless, lean, raw","Boeuf, longe, rôti de haut de surlonge, désossé, maigre, cru",1.25
6140,"Beef, loin, top sirloin roast, boneless, lean, cooked, roasted","Boeuf, longe, rôti de haut de surlonge, désossé, maigre, cuit, rôti",1.416
6142,"Beef, loin, top sirloin steak, boneless, lean and fat, 3mm (1/8"") trim, raw","Boeuf, longe, bifteck de haut de surlonge, désossé, maigre et gras, 3mm (1/8"") paré, cru",1.25
6143,"Beef, loin, top sirloin steak, boneless, lean, raw","Boeuf, longe, bifteck de haut de surlonge,  désossé, maigre, cru",1.25
6144,"Beef, loin, top sirloin steak, boneless, lean and fat, 0mm (0"") trim, cooked, broiled","Boeuf, longe, bifteck de haut de surlonge, désossé, maigre et gras, 0mm (0"") paré, cuit, grillé",1.416
