FoodID,FoodDescription,FoodDescriptionF,ConversionFactorValue
4211,"Candies, Rolo Caramels in milk chocolate","Bonbons, Rolo Caramels, enrobés de chocolat au lait",0.052
4212,"Candies, After Eight, chocolate mints","Bonbons, After Eight, mini-menthes enrobées de chocolat",0.164
4213,"Candies, sesame crunch (crisp)","Bonbons, croquant aux graines de sesame",0.4
4214,"Candies, bars, Snickers","Bonbons, tablettes, Snickers",0.4
4215,"Candies, Starburst fruit chews","Bonbons, Starburst bouchées de fruits",0.4
4217,"Candies, bars, 3 Musketeers","Bonbons, tablettes, 3 Musketeers",0.4
4218,"Candies, bars, Twix, caramel cookie","Bonbons, tablettes, Twix, biscuits au caramel",0.4
4219,"Candies, bars, Twix peanut butter cookie","Bonbons, tablettes, Twix, biscuits au beurre d'arachides",0.4
4220,"Candies, bars, Whatchamacallit","Candies, taglettes, Whatchamacallit",0.4
4221,"Candies, chewing gum","Bonbons, gomme à mâcher",0.03
4222,"Candies, bars, Special Dark","Bonbons, tablettes, Special Dark",0.4
4223,"Sweets, cocoa, powder, unsweetened","Confiseries, cacao, poudre, non sucré",0.05
4224,"Sweets, cocoa, powder, unsweetened, dutch process","Confiseries, cacao, poudre, non sucré, procédé néerlandais",0.05
4227,"Dessert, egg custard, dry mix, unprepared","Dessert, flan aux oeufs, mélange sec, non préparé",
4228,"Dessert, egg custard, dry mix prepared with whole milk","Dessert, flan aux oeufs, mélange sec, préparé avec lait entier",2.5783
4229,"Dessert, gelatin, dry mix, unprepared","Dessert, gélatine, mélange sec, non préparé",0.12162
4230,"Dessert, gelatin dry mix, prepared with water","Dessert, gélatine, mélange sec, préparé avec eau",2.85292
4232,"Dessert, gelatin, dry mix, calorie-reduced, with aspartame, unprepared","Dessert, gélatine, mélange sec, réduit en Calories, avec aspartame, non préparé",0.76
4233,"Dessert, gelatin, dry mix, calorie-reduced, with aspartame, prepared with water","Dessert, gélatine, mélange sec, réduit en Calories, avec aspartame, préparé avec eau",2.47253
4234,"Sweets, gelatin, dry powder, unsweetened","Confiseries, gélatine, poudre, non sucré",0.07
4237,"Dessert, pudding, chocolate, ready-to-eat","Dessert, pouding, chocolat, prêt-à-manger",0.99
4238,"Dessert, pudding, chocolate, dry mix, instant, unprepared","Dessert, pouding, chocolat, mélange sec, instantané, non préparé",
4241,"Dessert, flan, caramel custard, dry mix, unprepared","Dessert, flan au caramel, mélange sec, non préparé",
4242,"Dessert, pudding, chocolate, dry mix, regular, unprepared","Dessert, pouding, chocolat, mélange sec, régulier, non préparé",
4243,"Dessert, pudding, chocolate, dry mix, regular, prepared with whole milk","Dessert, pouding, chocolat, mélange sec, régulier, préparé avec lait entier",3.00085
4244,"Dessert, pudding, chocolate, dry mix, regular, prepared with 2% milk","Dessert, pouding, chocolat, mélange sec, régulier, préparé avec lait 2%",3.00085
4245,"Dessert, pudding, coconut, dry mix, instant, prepared with 2% milk","Dessert, pouding, noix de coco, mélange sec, instantané, préparé avec lait 2%",3.10651
4247,"Dessert, pudding, rice, ready to eat","Dessert, pouding, riz, prêt-à-manger",0.99
4248,"Dessert, pudding, rice, dry mix, unprepared","Dessert, pouding, riz, mélange sec, non préparé",
4249,"Dessert, pudding, rice, dry mix, prepared with whole milk","Dessert, pouding, riz, mélange sec, préparé avec lait entier",2.70512
4251,"Dessert, pudding, tapioca, dry mix, unprepared","Dessert, pouding, tapioca, mélange sec, non préparé",
4252,"Dessert, pudding, tapioca, dry mix, prepared with whole milk","Dessert, pouding, tapioca, mélange sec, préparé avec lait entier",2.97971
4254,"Dessert, pudding, vanilla, ready to eat","Dessert, pouding, vanille, prêt-à-manger",0.99
4255,"Dessert, pudding, vanilla, dry mix, instant, unprepared","Dessert, pouding, vanille, mélange sec, instantané, non préparé",
4257,"Dessert, pudding, lemon, dry mix, instant, prepared with 2% milk","Dessert, pouding, citron, mélange sec, instantané, préparé avec lait 2%",3.11708
4258,"Dessert, egg custard, dry mix, prepared with 2% milk","Dessert, flan aux oeufs, mélange sec, préparé avec lait 2%",2.81065
4259,"Dessert, pudding, vanilla, dry mix, regular, unprepared","Dessert, pouding, vanille, mélange sec, régulier, non préparé",
4260,"Dessert, pudding, vanilla, dry mix, regular, prepared with whole milk","Dessert, pouding, vanille, mélange sec, régulier, préparé avec lait entier",2.95858
4261,"Dessert, pudding, rice, dry mix, prepared with 2% milk","Dessert, pouding, riz, mélange sec, préparé avec lait 2%",2.70512
4262,"Dessert, pudding, tapioca, dry mix, prepared with 2% milk","Dessert, pouding, tapioca, mélange sec, préparé avec lait 2%",2.97971
4264,"Dessert, pudding, vanilla, dry mix, instant, prepared with 2% milk","Dessert, pouding, vanille, mélange sec, instantané, préparé avec lait 2%",3.00085
4265,"Dessert, pudding, vanilla, dry mix, regular, prepared with 2% milk","Dessert, pouding, vanille, mélange sec, régulier, préparé avec lait 2%",2.95858
4266,"Dessert, rennin, chocolate, dry mix, made with 2% milk","Dessert, rennine (présure), chocolat, mélange sec, préparé avec lait 2%",2.87405
4267,"Dessert, rennin, vanilla, dry mix, prepared with 2% milk","Dessert, rennine (présure), vanille, mélange sec, préparé avec lait 2%",2.81065
4268,"Dessert, frozen, gelatin pop","Dessert, congelé, pop à la gélatine",0.75
4270,"Dessert, frozen, ices, water, fruit, with aspartame","Dessert, congelé, glace à l'eau, fruits, avec aspartame",0.8116
4271,"Dessert, pudding, tapioca, ready-to-eat","Dessert, pouding, tapioca, prêt-à-manger",0.99
4272,"Dessert, pudding, coconut, dry mix, regular, prepared with 2% milk","Dessert, pouding, noix de coco, mélange sec, régulier, préparé avec lait 2%",2.95858
4273,"Dessert, rennin, chocolate, dry mix, unprepared","Dessert, rennine (présure), chocolat, mélange sec, non préparé",0.09122
4274,"Dessert, rennin, chocolate, dry mix, prepared with whole milk","Dessert, rennine, (présure), chocolat, mélange sec, préparé avec lait entier",2.87405
4275,"Dessert, rennin, vanilla, dry mix, unprepared","Dessert, rennine (présure), vanille, mélange sec, non préparé",0.10946
4276,"Dessert, rennin, vanilla, dry mix, prepared with whole milk","Dessert, rennine, (présure), vanille, mélange sec, préparé avec lait entier",2.87405
4278,"Dessert, rennin, tablets, unsweetened","Dessert, rennine (présure), comprimés, non sucrés",0.006
4279,"Dessert, flan, caramel custard, dry mix, prepared with 2% milk","Dessert, flan au caramel, mélange sec, préparé avec lait 2%",2.81065
4280,"Dessert, flan, caramel custard, dry mix, prepared with whole milk","Dessert, flan au caramel, mélange sec, préparé avec lait entier",2.81065
4281,"Icing (frosting), chocolate, creamy, dry mix, unprepared","Glaçage, chocolat, crémeux, mélange sec, non préparé",0.3153
4282,"Icing (frosting), chocolate, creamy, dry mix, prepared with butter","Glaçage, chocolat, crémeux, mélange sec, préparé avec beurre",1.11584
4283,"Icing (frosting), vanilla (white), creamy, dry mix, unprepared","Glaçage, vanille (blanc), crémeux, mélange sec, non préparé",
4284,"Icing (frosting), vanilla (white), creamy, dry mix, prepared with butter","Glaçage, vanille (blanc), crémeux, mélange sec, préparé avec beurre",
4285,"Icing (frosting), white, fluffy, dry mix, unprepared","Glaçage, blanc, velouté, mélange sec, non préparé",0.3153
4286,"Icing (frosting), white, fluffy, dry mix, prepared with water","Glaçage, blanc, velouté, mélange sec, préparé avec eau",0.4719
4287,"Dessert, frozen, fruit and juice bar","Dessert, congelé, barre de fruits et jus",0.77
4288,"Dessert, frozen, ice cream, chocolate","Dessert, congelé, crème glacée, chocolat",1.39476
4289,"Dessert, frozen, ice cream, strawberry","Dessert, congelé, crème glacée, fraises",1.39476
4290,"Dessert, frozen, ices, water, lime","Dessert, congelé, glaces à l'eau, lime",0.62765
4291,"Dessert, frozen, ice pop","Dessert, congelé, pop glacé",0.75
4292,"Dessert, frozen yogourt, vanilla, soft-serve","Dessert, congelé, yogourt glacé, vanille, mou",1.52156
4293,"Sweets, fruit butters, apple","Confiseries, beurre de fruits, pomme",0.6898
4294,"Sweets, honey, strained or extracted","Confiseries, miel, filtre ou extrait",0.07162
4295,"Sweets, jams and preserves","Confiseries, confitures et conserves",1.35135
4296,"Sweets, jellies","Confiseries, gelées",1.4189
4297,"Candies, fudge, chocolate marshmallow with nuts, homemade","Bonbons, fudge, chocolat et guimauves avec noix, fait maison",0.4
4298,"Sweets, marmalade, orange","Confiseries, marmelade, orange",0.40576
4299,"Sweets, fancy molasses","Confiseries, mélasse de fantaisie",3.56086
4300,"Sweets, molasses, blackstrap","Confiseries, mélasse noire (mélasse verte)",3.46577
4301,"Sweets, pectin, unsweetened, dry mix","Confiseries, pectine, non sucrée, mélange sec",0.006
4303,"Sweets, pie fillings, canned apple","Confiseries, garniture à tarte, conserve, pomme",1.39383
4304,"Sweets, pie fillings, canned, cherry","Confiseries, garniture à tarte, conserve, cerise",0.8369
4305,"Dessert, pudding, banana, dry mix, instant, unprepared","Dessert, pouding, banane, mélange sec, instantané, non préparé",
4306,"Dessert, pudding, banana, dry mix, instant, prepared with whole milk","Dessert, pouding, banane, mélange sec, instantané, préparé avec lait entier",3.11708
4307,"Dessert, pudding, banana, dry mix, regular, unprepared","Dessert, pouding, banane, mélange sec, régulier, non préparé",
4308,"Dessert, pudding, banana, dry mix, regular, prepared with whole milk","Dessert, pouding, banane, mélange sec, régulier, préparé avec lait entier",2.95858
4309,"Dessert, pudding, coconut, dry mix, instant, unprepared","Dessert, pouding, noix de coco, mélange sec, instantané, non préparé",
4310,"Dessert, pudding, coconut, dry mix, instant, prepared with whole milk","Dessert, pouding, noix de coco, mélange sec, instantané, préparé avec lait entier",3.11708
4311,"Dessert, pudding, coconut, dry mix, regular, unprepared","Dessert, pouding, noix de coco, mélange sec, régulier, non préparé",
4312,"Dessert, pudding, coconut, dry mix, regular, prepared with whole milk","Dessert, pouding, noix de coco, mélange sec, régulier, préparé avec lait entier",2.95858
4313,"Dessert, pudding, lemon, dry mix, instant, unprepared","Dessert, pouding, ditron, mélange sec, instantané, non préparé",
4314,"Dessert, pudding, lemon, dry mix, instant, prepared with whole milk","Dessert, pouding, citron, mélange sec, instantané, préparé avec lait entier",3.11708
4315,"Dessert, pudding, lemon, dry mix, regular, unprepared","Dessert, pouding, citron, mélange sec, régulier, non préparé",
4316,"Dessert, pudding, lemon, dry mix, regular, prepared","Dessert, pouding, citron, mélange sec, régulier, préparé",1.3789
4317,"Sweets, sugar, brown","Confiseries, sucre, brun (cassonade)",0.04649
4318,"Sweets, sugars, granulated","Confiseries, sucre, granulé",0.04
4319,"Sweets, sugars, icing (powdered)","Confiseries, sucre à glacer",0.02509
4320,"Sweets, sugars, maple, hard","Confiseries, sucre d'érable, dur",0.15
4321,"Sweets, syrups, chocolate, fudge-type","Confiseries, sirop, chocolat, type fudge",0.38546
4322,"Sweets, syrups, corn, dark","Confiseries, sirop de maïs, foncé",0.41589
4323,"Sweets, syrups, corn light","Confiseries, sirop de maïs, clair",0.41589
4324,"Sweets, syrups, corn, high-fructose","Confiseries, sirop de maïs, élevé en fructose",0.39306
4325,"Sweets, syrups, malt","Confiseries, sirop de malt",0.42099
4326,"Sweets, syrups, maple, bulk","Confiseries, sirop d'érable, en vrac",0.39943
4327,"Sweets, syrups, sorghum","Confiseries, sirop de sorgho",0.41843
4328,"Sweets, syrups, table blends, pancake, with 2% maple","Confiseries, sirop de table, crêpe, avec 2% érable",0.39941
4329,"Sweets, syrups. table blends, cane and 15% maple","Confiseries, sirop de table, canne et 15% érable",0.39941
4330,"Sweets, syrups, table blends, corn, refiner's syrup and sugar","Confiseries, sirop de table, maïs, sirop de raffinerie et sucre",0.40068
4331,"Sweets, topping (spread), butterscotch or caramel","Confiseries, garniture (tartinade), caramel",0.3
4332,"Sweets,  topping, marshmallow cream","Confiseries, garniture, crème de guimauve",0.3
4333,"Sweets, topping, pineapple","Confiseries, garniture, ananas",0.3
4334,"Sweets, topping, nuts in syrup","Confiseries, garniture, noix dans sirop",0.3
4335,"Candies, Skittles","Bonbons, Skittles",0.57
4336,"Icing (frosting), vanilla (white), creamy, dry mix, prepared with margarine","Glaçage, vanille (blanc), crémeux, mélange sec, préparé avec margarine",
4337,"Icing (frosting), chocolate, creamy, dry mix, prepared with margarine","Glaçage, chocolat, crémeux, mélange sec, préparé avec margarine",0.39053
4340,"Icing (frosting), glaze, homemade","Glaçage, fondant, fait maison",0.4719
4350,"Dessert, frozen yogourt, chocolate, soft-serve","Dessert, congelé, yogourt glacé, chocolat, mou",1.52156
4351,"Snacks, banana chips","Grignotises, croustilles de bananes séchées",0.5
4352,"Snacks, corn nuts, barbecue","Grignotises, grignotises de maïs (corn nuts), barbecue",0.27
4354,"Snacks, crisped rice bar, almond","Grignotises, barre de riz croustillant, amandes",0.5
4358,"Meat sticks, beef, non-refrigerated, smoked","Bâtonnets de viande, non-réfrigérés, fumés",0.5
4359,"Snacks, pork skins, barbecue","Grignotises, croustilles de porc, barbecue",0.5
4360,"Snacks, potato chips, dried potatoes, plain","Grignotises, croustilles de pommes de terre séchées, nature",0.28
4361,"Snacks, potato chips, dried potatoes, cheese","Grignotises, croustilles de pommes de terre séchées, fromage",0.5
4362,"Snacks, rice cakes, brown rice, corn","Grignotises, galettes de riz brun, maïs",0.18
4363,"Snacks, rice cakes, brown rice, multigrain","Grignotises, galettes de riz brun, multigrains",0.18
4364,"Snacks, potato sticks","Grignotises, bâtonnets de pommes de terre",0.5
4365,"Snacks, rice cakes, brown rice, rye","Grignotises, galettes de riz brun, seigle",0.18
4366,"Snacks, sesame sticks, wheat-based, salted","Grignotises, bâtonnets de sésame, base de blé, salés",0.1395
4367,"Snacks, corn cakes","Grignotises, galettes de maïs",0.22
4369,"Snacks, potato chips, cheese","Grignotises, croustilles de pommes de terre, fromage",0.33814
4371,"Snacks, tortilla chips, nacho, light","Grignotises, croustilles, tortilla, nacho, légères",0.38
4372,"Snacks, taro chips","Grignotises, croustilles de taro",0.5
4373,"Sweets, chocolate, semisweet, made with butter","Confiseries, chocolat, mi-sucré, préparé avec beurre",0.4
4374,"Icing (frosting), chocolate, creamy, ready-to-eat","Glaçage, chocolat, crémeux, prêt-à-manger",1.38635
4375,"Icing (frosting), coconut-nut, ready to eat","Glaçage, noix de coco-noix, prêt-à-manger",0.4142
4376,"Icing (frosting), cream cheese flavour, ready to eat","Glaçage, saveur de fromage à la crème, prêt-à-manger",0.4719
4377,"Icing (frosting), sour cream flavour, ready to eat","Glaçage, saveur de crème sure, prêt-à-manger",0.4719
4378,"Icing (frosting), vanilla (white), creamy, ready-to-eat","Glaçage, vanille (blanc), crémeux, prêt-à-manger",0.39055
4379,"Sweets, jams and preserves, apricot","Confiseries, confitures et conserves, abricot",0.2027
4380,"Candies, bars / chips, semisweet chocolate with butter","Bonbons, carrés / grains (pépites), chocolat mi-sucré avec beurre",0.4
4381,"Snacks, corn cakes, very low sodium","Grignotises, galettes de maïs, ultra faible en sodium",0.18
4382,"Snacks, popcorn, air-popped, white popcorn","Grignotises, mais soufflé à l'air, nature, maïs blanc",0.16906
4383,"Snacks, popcorn, oil-popped, white popcorn, with salt","Grignotises, maïs soufflé à l'huile, maïs blanc, sel ajouté",0.5
4386,"Snacks, pretzels, hard, plain, unsalted","Grignotises, bretzels, durs, nature, sans sel",0.05
4387,"Snacks, rice cakes, brown rice, plain, unsalted","Grignotises, galettes de riz brun, nature, sans sel",0.18
4388,"Snacks, rice cakes, brown rice, buckwheat, unsalted","Grignotises, galettes de riz brun, nature, sarrasin, sans sel",0.18
4389,"Snacks, rice cakes, brown rice, multigrain, unsalted","Grignotises, galettes de riz brun, multigrains, sans sel",0.18
4390,"Snacks, rice cakes, brown rice, sesame seed, unsalted","Grignotises, galettes de riz brun, graines de sésame, sans sel",0.18
4391,"Snacks, sesame sticks, wheat-based, unsalted","Grignotises, bâtonnets de sésame, base de blé, sans sel",0.5
4392,"Snacks, trail mix, regular, unsalted","Grignotises, mélange montagnard, régulier, non salé",0.5
4393,"Snacks, trail mix, regular with chocolate chips, unsalted","Grignotises, mélange montagnard, régulier avec grains de chocolat, sans sel",0.5
4394,"Snacks, pretzels, hard, plain, salted","Grignotises, bretzels, durs, nature, salés",0.18
4396,"Candied foods, maraschino cherries, jar, solids and liquid","Confits, cerises au marasquin, bocal, solides et liquide",0.043
4397,"Candied foods, cherries","Confits, cerises",0.3
4398,"Candied foods, citron","Confits, cédrat",0.3
4400,"Candied foods, ginger root, crystallized","Confits, gingembre, racine, cristallisée",0.3
4401,"Candied foods, grapefruit peel","Confits, pamplemousse, pelure",0.3
4402,"Candied foods, lemon peel","Confits, citron, pelure",0.3
4403,"Candied foods, orange peel","Confits, orange, pelure",0.3
4405,"Candied foods, pineapple","Confits, ananas",0.3
4407,"Snacks, potato chips, plain, salted","Grignotises, croustilles de pommes de terre, nature",0.33814
4409,"Grains, amaranth, raw","Grains céréaliers, amarante, cru",0.45
4410,"Grains, arrowroot flour","Grains céréaliers, farine d'arrowroot",0.3
4411,"Grains, barley, pearled, dry","Grains céréaliers, orge, perlé, sec",0.45
4412,"Grains, buckwheat groats, roasted, dry","Grains céréaliers, gruau de sarrasin, rôti, sec",0.45
4413,"Grains, buckwheat groats, roasted, cooked","Grains céréaliers, gruau de sarrasin, rôti, cuit",1.4
4414,"Grains, bulgur, dry","Grains céréaliers, bulgur, sec",0.45
4415,"Grains, corn, yellow, field, dry","Grains céréaliers, maïs, jaune, campagnard, sec",0.45
4416,"Grains, corn bran, crude","Grains céréaliers, son de maïs, brut",0.15
4417,"Grains, corn flour, yellow, whole-grain","Grains céréaliers, farine de maïs, jaune, grain entier",0.3
4418,"Grains, cornmeal (yellow), whole-grain","Grains céréaliers, semoule de maïs (jaune), grain entier",1.2891
4419,"Grains, cornstarch","Grains céréaliers, fécule de maïs",0.1
4420,"Grains, couscous, dry","Grains céréaliers, couscous, sec",0.45
4421,"Grains, oats","Grains céréaliers, avoine",0.45
4422,"Grains, rice, brown, medium-grain, dry","Grains céréaliers, riz brun, grain moyen, sec",0.45
4423,"Grains, rice, brown, medium-grain, cooked","Grains céréaliers, riz brun, grain moyen, cuit",1.4
4424,"Grains, rice, white, glutinous, dry","Grains céréaliers, riz blanc, glutineux, sec",0.45
4425,"Grains, rice, white, glutinous, cooked","Grains céréaliers, riz blanc, glutineux, cuit",1.4
4426,"Grains, rice, white with pasta and seasonings, dry","Grains céréaliers, riz blanc avec pâtes et assaisonnements, sec",0.45
4427,"Grains, rice, white with pasta and seasonings, cooked","Grains céréaliers, riz blanc avec pâtes et assaisonnements, cuit",1.4
4428,"Grains, rice bran, crude","Grains céréaliers, son de riz, brut",0.15
4429,"Grains, rice flour, white","Grains céréaliers, riz blanc, farine",0.8346
4430,"Grains, rye flour, medium","Grains céréaliers, farine de seigle moyenne",0.3
4431,"Grains, rye flour, light","Grains céréaliers, farine de seigle pâle",0.5389
4432,"Grains, sorghum","Grains céréaliers, sorgho",0.45
4433,"Grains, tapioca, pearl, dry","Grains céréaliers, tapioca, perlé, sec",0.45
4434,"Grains, triticale","Grains céréaliers, triticale",0.45
4435,"Grains, triticale flour, whole-grain","Grains céréaliers, farine de triticale, grain entier",0.3
4436,"Grains, wheat, hard red spring","Grains céréaliers, blé de force roux de printemps (blé vitreux roux de printemps)",0.45
4437,"Grains, wheat, hard red winter","Grains céréaliers, blé de force roux d'hiver (blé vitreux roux d'hiver)",0.45
4438,"Grains, wheat, soft red winter","Grains céréaliers, blé tendre rouge d'hiver",0.45
4439,"Grains, wheat, hard white","Grains céréaliers, blé blanc dur",0.45
4440,"Grains, wheat, soft white","Grains céréaliers, blé blanc tendre",0.45
4441,"Grains, wheat, durum","Grains céréaliers, blé durum",0.45
4442,"Grains, wheat bran, crude","Grains céréaliers, son de blé, brut",0.03677
4443,"Grains, wheat germ, crude","Grains céréaliers, germe de blé, brut",0.07291
4444,"Grains, wheat flour, white, self-rising","Grains céréaliers, farine de blé, blanche, avec levure",0.3
4445,"Grains, wheat flour, white, bread flour","Grains céréaliers, farine de blé, blanche, farine à pain",0.7238
4446,"Grains, wheat flour, white, cake flour","Grains céréaliers, farine de blé, blanche, farine à gâteau",0.7238
4447,"Grains, wheat flour, white, tortilla mix","Grains céréaliers, farine de blé, blanche, préparation pour tortilla",0.3
4448,"Grains, wheat, sprouted","Grains céréaliers, blé, germé",0.15
4449,"Grains, rice, wild, dry","Grains céréaliers, riz sauvage, sec",0.45
4450,"Grains, rice, wild, cooked","Grains céréaliers, riz sauvage, cuit",1.4
4451,"Grains, rice flour, brown","Grains céréaliers, farine de riz brun",0.3
4452,"Pasta, corn, dry","Pâtes, maïs, sèches",0.85
4453,"Pasta, corn, cooked","Pâtes, maïs, cuites",2.15
4454,"Pasta, made with egg, homemade, cooked","Pâtes, préparées avec des oeufs, faites maison, cuites",2.15
4455,"Pasta, made without egg, homemade, cooked","Pâtes, préparées sans oeufs, faites maison, cuites",2.15
4456,"Pasta, macaroni (elbow), whole wheat, dry","Pâtes, macaroni (coudes), blé entier, sec",0.85
4457,"Pasta, macaroni (elbow), whole wheat, cooked","Pâtes, macaroni (coudes), blé entier, cuit",2.15
4458,"Pasta, egg noodles, enriched, cooked","Pâtes, nouilles aux oeufs, enrichies, cuites",2.15
4459,"Pasta, Chinese noodles, chow mein","Pâtes, nouilles chinoises, chow mein",0.25
4460,"Pasta, Japanese noodles, soba, dry","Pâtes, nouilles japonaises, soba, sèches",0.85
4461,"Pasta, Japanese noodles, soba, cooked","Pâtes, nouilles japonaises, soba, cuites",2.15
4462,"Pasta, Japanese noodles, somen, dry","Pâtes, nouilles japonaises, somen, sèches",0.85
4463,"Pasta, Japanese noodles, somen, cooked","Pâtes, nouilles japonaises, somen, cuites",2.15
4464,"Pasta, spaghetti, enriched, cooked","Pâtes, spaghetti, enrichi, cuit",2.15
4465,"Grains, corn flour, masa, yellow, U.S. enriched","Grains céréaliers, farine de maïs, masa, jaune, enrichi selon les normes des É.U.",0.3
4466,"Pasta, spaghetti, enriched, cooked, salted","Pâtes, spaghetti, enrichi, cuit, salée",2.15
4467,"Grains, hominy, canned, yellow","Grains céréaliers, farine de maïs bouillie, conserve, jaune",0.45
4468,"Pasta, egg noodles, unenriched, cooked","Pâtes, nouilles aux oeufs, non enrichies, cuites",2.15
4469,"Pasta, spaghetti, unenriched, cooked","Pâtes, spaghetti, non enrichi, cuit",2.15
4470,"Grains, cornmeal (yellow), degermed","Grains céréaliers, semoule de maïs (jaune), dégermée",1.6801
4471,"Grains, rice, white, long-grain, regular, dry","Grains céréaliers, riz blanc, grain long, ordinaire, sec",0.45
4472,"Grains, rice, white, long-grain, parboiled, dry","Grains céréaliers, riz blanc, grain long, étuvé, sec",0.45
4473,"Grains, rice, white, long-grain, parboiled, cooked","Grains céréaliers, riz blanc, grain long, étuvé, cuit",1.4
4474,"Grains, rice, white, medium-grain, dry","Grains céréaliers, riz blanc, grain moyen, sec",0.45
4475,"Grains, rice, white, medium-grain, cooked","Grains céréaliers, riz blanc, grain moyen, cuit",1.4
4476,"Grains, rice, white, short-grain, dry","Grains céréaliers, riz blanc, grain court, sec",0.45
4477,"Grains, rice, white, short-grain, cooked","Grains céréaliers, riz blanc, grain court, cuit",1.4
4478,"Grains, semolina","Grains céréaliers, semoule de blé dur",0.45
4479,"Pasta, egg noodles, unenriched, cooked, salted","Pâtes, nouilles aux oeufs, non enrichies, cuites, salées",2.15
4480,"Pasta, spaghetti, unenriched, cooked, salted","Pâtes, spaghetti, non enrichi, cuit, salé",2.15
4481,"Grains, rice, white, long-grain, pre-cooked or instant, enriched, dry","Grains céréaliers, riz blanc, grain long, précuit ou instantané, enrichi, sec",0.45
4482,"Grains, rice, white, long-grain, pre-cooked or instant, enriched, prepared","Grains céréaliers, riz blanc, grain long, précuit ou instantané, enrichi, préparé",1.4
4483,"Pasta, egg noodles, enriched, cooked, salted","Pâtes, nouilles aux oeufs, enrichies, cuites, salées",2.15
4484,"Grains, wheat flour, white, all purpose, enriched, calcium fortified","Grains céréaliers, farine de blé, tout usage, enrichie, calcium ajouté",0.3
4485,"Grains, barley, dry","Grains céréaliers, orge, sec",0.45
4486,"Grains, barley, pearled, cooked","Grains céréaliers, orge, perlé, cuit",1.4
4487,"Grains, buckwheat","Grains céréaliers, sarrasin",0.45
4488,"Grains, buckwheat flour, whole-groat","Grains céréaliers, farine de sarrasin, gruau entier",0.3
4489,"Grains, bulgur, cooked","Grains céréaliers, bulgur, cuit",1.4
4490,"Grains, couscous, cooked","Grains céréaliers, couscous, cuit",1.4
4491,"Grains, millet, dry","Grains céréaliers, millet, sec",0.45
4492,"Grains, millet, cooked","Grains céréaliers, millet, cuit",1.4
4493,"Grains, oat bran, dry","Grains céréaliers, son d'avoine, sec",0.4
4494,"Grains, oat bran, cooked","Grains céréaliers, son d'avoine, cuit",1.4
